42,解析《罗密欧与朱丽叶》的四种结构,冯捷,西安音乐学院现代音乐学院,结构主义;《罗密欧与朱丽叶》;舞剧;音乐剧;,"文章对舞剧、音乐剧不同版本的《罗密欧与朱丽叶》进行比较研究,探讨包括时间性结构在内的叙述语境之建构、叙述视角的延续与变换、整全与局部之关系、叙述节奏与段落甄选原则。文章解析约翰·克兰科(John Cranko)、安杰林·普林祖卡(Angelin Preljocaj)、沙莎·瓦兹(Sasha Waltz)的舞剧及音乐剧共四个版本的《罗密欧与朱丽叶》之结构特征,对同一主题的不同舞台艺术形式表演进行对比论证,聚焦于舞台艺术作品结构的实践与学理性探讨,旨在为表演艺术的舞台实践研究提供参考和借鉴。",北京舞蹈学院学报,2018-10-31,期刊,J733;J832,83-86,4
43,新媒体互动技术在舞剧中的运用,李青,北京舞蹈学院创意学院,新媒体互动设计;舞蹈互动;舞台合成;,"本文通过对新媒体互动设计制作,及其在舞台创作和实践过程中所涉及问题的论述,以具体案例《游园惊梦》为例,阐述新媒体舞剧中的新媒体互动设计与舞台舞蹈创作上的具体实操问题,为今后的新媒体舞剧创作提供经验。",北京舞蹈学院学报,2018-10-31,期刊,J723,32-35,4
44,第二届“一带一路”民族传统舞蹈展演,,《北京舞蹈学院学报》编辑部,O,"<正>2018年10月12日晚,由北京舞蹈学院主办,北京市哲学社会科学民族舞蹈文化研究基地、北京市海淀区文化委员会承办的第二届""一带一路""民族传统舞蹈展演在北京舞蹈学院舞蹈剧场成功举办。展演中的12个剧目以及此次展演所征集的珍贵舞蹈资料均进入民族舞蹈文化研究基地""中国民族舞蹈学术资源库""。中央电视台、《中国文化报》等媒体对此次展演活动进行了报道。民族舞蹈文化研究基地承续""和平合作、开放",北京舞蹈学院学报,2018-10-31,期刊,J722.22-2,2+125-128,5
45,云南少数民族民间舞蹈美学探索,徐梅,云南艺术学院舞蹈学院,舞蹈美学;艺术人类学;云南少数民族民间舞蹈;“大美”;,"舞蹈作为一种身体语言艺术,其审美研究具有重要意义。关于云南少数民族民间舞蹈美学研究,应将中国舞蹈美学与云南少数民族民间舞蹈研究结合,并树立民族民间舞之美为""大美""的校正意识。在大力提倡""文化多样性""的今天,唯有不断完善民族民间舞蹈的学科建设,加强民族民间舞蹈美学领域的研究,方能为民族民间舞蹈艺术的发展与创新奠定坚实的理论基础。",北京舞蹈学院学报,2018-10-31,期刊,J722.2,92-96,5
46,地域文化的多层性:赣南采茶舞的当代形态分析,桂兰岚,深圳大学师范学院(部)舞蹈系,赣南采茶舞;舞蹈形态;文化价值;,"赣南采茶舞是中国民俗舞蹈的重要组成部分,在中原文化、客家文化、畲族文化的共同浸润下,展现出独有的风格特征。文章通过对赣南采茶舞""游艺""形态与""演艺""形态的表演特征的剖析,探索赣南采茶舞乡野化的民俗特征与舞台创作的审美价值,思考民俗文化传播与非遗传承保护在当下的发展。",北京舞蹈学院学报,2018-10-31,期刊,J722.21,97-100,4
47,舞乐关系的理论基础及“同化”研究,田旭,上海师范大学音乐学院,舞蹈;音乐;关系;同化;,"舞蹈通常与多种艺术形式联结协作,其根本原因在于人体作为舞蹈的物质媒介,在身心两方面都有局限性,这使人之内在情感的表现需要与人之身体相对有限的表达能力之间产生矛盾。要消解这一矛盾,舞蹈必然要借助其他艺术媒介拓宽表现力。在所有艺术形式中,音乐具有最大的抽象表现力,作为纯粹的时间艺术,参与其他艺术的能力最强且机会最多。因此,舞蹈与音乐结为最紧密的协作关系,节奏在其中发挥了关键作用。同时,在舞蹈与音乐的联结协作这一现象中,隐藏着深层的规律,即""物质材料""""审美效能""""时空关系""""舞乐节奏""四层。此外,舞蹈强大的""同化""能力使音乐从属于舞蹈,确保了舞蹈在与音乐协作过程中的独立性与主动性。",北京舞蹈学院学报,2018-10-31,期刊,J618,101-105,5
48,《天鹅湖》“终场”的音乐与舞剧版本探究,陈悦,上海戏剧学院舞蹈学院,舞剧音乐;戏剧内涵;舞编设计;版本比照;,"本文以《天鹅湖》终场部分的舞剧音乐在不同舞剧版本中的""多解""现象为切入点,阐释不同的舞剧编导对同一部舞剧音乐所持的不同体认与理解。在对舞剧""终场""部分音乐的分析中,通过对音乐、舞蹈、戏剧的综合性比较研究,分析不同编导在舞剧音乐及戏剧内涵上迥异的审美体认,以及由此体现出的对舞剧戏剧内涵与戏剧精神的不同理解,并对之加以比照和品评。",北京舞蹈学院学报,2018-10-31,期刊,J733.4;J618,106-114,9
49,中国古典舞身韵的钢琴伴奏技巧研究,刘姝,天津大学教育学院,古典舞身韵;钢琴伴奏;选曲;伴奏技巧;,"钢琴作为伴奏器乐,具有宽广的音域、丰富的和声、多样的织体,能够通过弹性节奏展示中国古典舞身韵的内在韵律和延展性。恰当掌握中国古典舞身韵选曲路径,通过对比夸张的手法在音乐风格、音乐结构以及音乐情感上与中国古典舞身韵完美结合,达到艺术上的和谐统一。",北京舞蹈学院学报,2018-10-31,期刊,J624.1;J722.4,120-124,5
50,从“公孙大娘”到“中国大妈”:刍议作为中国舞蹈史最新篇章的广场舞,胡一峰,《中国文艺评论》编辑部,广场舞;中国舞蹈史;现代化;伴生性;,"""广场舞""是当下最受舆论关注的文化现象之一。它的出现反映了艺术生活化的发展趋势,生动诠释了党的""十九大""报告关于我国社会主要矛盾转化的论断。""广场舞""具有强烈的""伴生性"",它是社会文化变化的产物,而非舞蹈艺术内部逻辑演化的结果。作为中国社会发展总体性特征在舞蹈艺术中的呈现,以及当代中国民众以艺术的方式对中国社会发展的回应,""广场舞""的确立表明舞蹈或文艺与社会的互动进入到了一个新的阶段。从这个意义上说,广场舞是中国舞蹈史的最新篇章。",北京舞蹈学院学报,2018-10-31,期刊,J722.1,1-7,7
51,广场舞女性日常生活的群体互动与身份建构,刘建;吴理财,华中师范大学,广场舞女性;社会关系;体化实践;社会身份;群体互动;,"自改革开放以来,我国经历了从""解放政治""向""生活政治""的历史变迁,广场舞也成为个体追求自我生活方式的现实体现。广场舞不仅作为中老年女性进行体化实践的场域,还更是个体化社会群体身份建构的一种表征。作为体化实践的重要机制,中老年女性这一群体通过广场舞有效实现了身体展示、""集体""意义的编织及群体互动的分层效应。但在个体化社会,广场舞女性这一群体的社会身份呈现个体认同的符号化、社会形象的污名化及群体归属的情景性等悖论。为推动广场舞女性社会身份的正常化,需要建构包容性公民身份的发展路径,进而承认其平等的公民身份权利来实现社会的再嵌入。",北京舞蹈学院学报,2018-10-31,期刊,J722.1,8-14,7
52,身体“记忆”——以广场舞蹈作为媒介的社会记忆的继承与流变,朱紫薇;刘炼,东北师范大学音乐学院,广场舞蹈;社会记忆;民族文化;个体与集体;,"广场舞蹈作为一个社会的""记忆""不仅位于民族历史和政治文化的中心,同时也在个人和集体的身份认同中发挥着力量。本文从以下三个维度考察广场舞蹈作为一种社会记忆的媒介在时代的长河中不断被继承和产生的变化:一、广场舞蹈与历史之关联;二、广场舞蹈与个人、集体情感归属之关联;三、广场舞蹈与民族文化之间的关联。通过对凸显历史、集体、民族文化流变的媒介——广场舞蹈的考察,不仅丰富、细化这种形态的来源,而且希望能够寻觅到一条新的研究线索,并使这条线索能够具有延展性,在日后的研究中也可以得到更好的完善。",北京舞蹈学院学报,2018-10-31,期刊,J722.1,15-19,5
53,山西地方高校中国民间舞教学改革现状及策略,赵萌,山西大学音乐学院,中国民族民间舞;地方高校;继承与发展;改革;课堂建设;,"本文从地方高校保护和发展当地民间舞蹈方式方法的角度出发,通过调查研究,结合山西省内高校民间舞蹈教学的现状分析及本人的教学实践,在归纳目前地方高等院校民间舞蹈教育存在问题的基础上,提出解决方案。",北京舞蹈学院学报,2018-10-31,期刊,J722.21-4;G642,56-60,5
54,大数据思维下的舞蹈科学训练路径探索——以完整的双边教学过程为例,林欣甫,天津师范大学音乐与影视学院舞蹈系,大数据思维;舞蹈训练;双边教学;,"在全球化发展背景下,信息传播速度加快,空间距离逐渐被拉近,信息的种类和数量也越来越丰富,数据呈现出多样性特征,大数据思维也应运而生。舞蹈科学训练发展也呈现新趋势,将科学的数据分析运用到舞蹈科学训练中,不仅可以夯实舞蹈训练的科学性基础,也将舞蹈训练与新兴技术连接,更为重要的是顺应时代发展趋势,对于舞蹈人才的全面培养和发展具有重要意义。",北京舞蹈学院学报,2018-10-31,期刊,J712.2-4,65-71,7
55,闽南舞蹈诗《沉沉的厝里情》的艺术形式与文化视角,陈凯丽,华侨大学音乐舞蹈学院,闽南文化;舞蹈诗;《沉沉的厝里情》;,"闽南舞蹈诗《沉沉的厝里情》于2012年由厦门小白鹭民间舞艺术中心打造完成,获得第九届中国舞蹈""荷花奖""金奖及第五届福建省艺术节一等奖。这部饱含着浓浓闽南文化和华侨文化的作品,以朴实的舞蹈语汇讲述了一个闽南渔村的故事。作品在地方民俗艺术的演绎中传颂着人间的真善美,传达着全剧的中心思想——回归。该剧具有一定的思想高度和审美判断,也对闽南文化如何走向新阶段具有深刻的启发和借鉴。文章通过分析作品的艺术特色,即作品中各类民间艺术的展现、艺术精神的表现以及艺术情感的诗化,阐发对闽南文化在新时期如何发展的思考与建议。",北京舞蹈学院学报,2018-10-31,期刊,J722.7,87-91,5
56,音乐剧演唱教学中女声真混声演唱技巧训练与应用,郭鹏,北京舞蹈学院音乐剧系,真声演唱;混声演唱;真混声结合训练;,"女声真混声演唱技巧在音乐剧女声教学中是一项训练的重点,也是难点,该技巧对推动女声音乐剧演唱能力、声音技术能力、音域的拓展都有深远的影响。文章从真混声演唱技巧为何适用于音乐剧女声声乐教学、音乐剧演唱中真混声技巧训练、女声真混声演唱技巧在音乐剧作品中的运用三大方面展开论述,阐述了女声真混声演唱技巧训练与应用在音乐剧教学中的重要意义。",北京舞蹈学院学报,2018-10-31,期刊,J617.2-4,115-119,5
57,1978—2014北京舞蹈学院新时期舞蹈经典作品,,北京舞蹈学院中国民族民间舞系、科研处,O,O,北京舞蹈学院学报,2018-10-31,期刊,J42,129,1
58,《北京舞蹈学院学报》被评定为“2018年度中国人文社会科学期刊AMI综合评价”A刊核心期刊,本刊讯,O,O,"<正>中国社会科学评价研究院于2018年11月16日在""第五届全国人文社科高峰论坛暨期刊评价会""上发布《中国人文社科学期刊AMI综合评价报告(2018年)》,基于学科与期刊特点构建了不同的期刊评价指标体系,对我国1291种人文社会科学期刊(2012年及以前创刊)、164种新刊(2013—2017年创刊或更名)及68种英文期刊进行了评价。其中,《北京舞蹈学院学报》被评定为""2018年度中国人文社会科学期刊AMI综",北京舞蹈学院学报,2018-10-31,期刊,+,91,1
59,唐代巴中石窟飞天艺术的造型特征及审美表达,邓新航;龙红,东南大学重庆大学,巴中石窟;唐代飞天;舞蹈造型;审美表达;,"唐代巴中石窟飞天艺术是南方飞天艺术的代表,不仅数量多、雕刻精,而且姿态动作千变万化。唐代巴中飞天集中出现于初唐和盛唐时期,大致与巴中石窟发展演变的情况相吻合。从唐代巴中飞天的形体、面貌、服饰及动态等方面来看,初唐飞天显得优美灵动,盛唐飞天则显得优雅雍容。在巴蜀传统文化、审美风尚等多种因素的综合和主导影响下,唐代巴中飞天表现出飞动美、装饰美和写实美的独特审美追求。",北京舞蹈学院学报,2018-08-31,期刊,K879.3;J709.2,38-45,8
60,彝族花鼓舞民间自组织“花鼓会”的结构与功能,黄龙光,云南师范大学学报编辑部,彝族民间花鼓会;结构与功能;送灵归祖;,"作为一种典型的丧礼仪式灵舞,彝族花鼓舞主要的传承力量来自花鼓舞背后的民间花鼓会。在滇中峨山彝族自治县,几乎每一个村组均有自己的花鼓会。彝族民间花鼓会在共同地缘的基础上,由一定家庭自愿组建并拜师传习花鼓舞展演的套路、动作与技巧。彝族民间花鼓会通过组织各种彝族花鼓舞展演,在彝族社会发挥着""送灵归祖""、文化传承、生产互助与角色协调等多重功能。作为非物质文化遗产,彝族花鼓舞的传承与保护工作,应考虑重点资助和支持彝族花鼓会这样的民间自组织开展一系列相关的文化传承实践活动。",北京舞蹈学院学报,2018-08-31,期刊,J722.212,59-65,7
61,舞蹈艺术的影视化呈现及其特点,尹航,山东青年政治学院舞蹈学院,舞蹈艺术;影视化呈现;审美特点;,"在舞台之外,大众传媒语境下的舞蹈艺术表现出鲜明的影视化特征。以电影、电视与网络视频为媒介的影视化呈现,丰富了舞蹈艺术的实现形态,改变了舞蹈艺术传统的审美特点。同时,这种呈现方式也在当前环境变革与时代审美心理的激变中,促使舞蹈这门古老的艺术形式持续勃发鲜活的生命力与内在价值。文章在全面梳理舞蹈艺术影视化呈现形态的基础上,立足于传播学的视角对这一变革加以剖析,并通过探寻其深层的社会文化动因,指出这一变革对舞蹈艺术发展的积极意义。",北京舞蹈学院学报,2018-08-31,期刊,J705,85-90,6
62,“文化杂食主义”视角下的网络舞蹈视频与“互联网+”时代的文化分层,鞠高雅;林一,北京大学,文化消费;文化杂食主义;自媒体;“互联网”+;消费分层;,"文章通过引入""文化杂食主义""的概念,以互联网舞蹈视频为例,从文化分层的角度剖析互联网文化、自媒体运作以及当前互联网文化产业发展趋势。文章认为,互联网自媒体虽然最早脱胎于""草根""大众和流行文化,但随着时间的发展,如今的自媒体已经不由""草根""大众主导。相反,它们更近似于文化研究理论中的""杂食主义者""概念。表面上由""草根""大众""自发发起""""自主选择""的文化消费潮流,其内涵往往十分复杂。因此,研究者提出,对于互联网文化产业和市场的分析,不能一味沿用旧有模式,需要将基于互联网平台的新型文化和消费分层模式纳入考虑。",北京舞蹈学院学报,2018-08-31,期刊,J705,71-77,7
63,新媒体背景下舞蹈传播与产业发展探析,李娜,苏州市职业大学艺术学院,新媒体舞蹈;舞蹈传播;文化产业;,"随着新媒体技术的出现,各产业跨界融合,新媒体舞蹈艺术也随之产生和发展。目前学界多集中于对新媒体舞蹈的表演形式和风格方面的阐述,文章从""传播学""和""文化产业""两个学科的维度对新媒体舞蹈进行探析。以""新媒体舞蹈传播""和""新媒体舞蹈产业""视角,讨论舞蹈艺术多元纵深的延展力与包容并进的强大生命力。文章强调,在全球一体化的今天,要想讲好中国故事,就需要运用新媒体传播中国的文化艺术,向世界人民展示优秀中华文化,提升国家软实力。",北京舞蹈学院学报,2018-08-31,期刊,J705,78-84,7
64,琵琶春秋礼乐魂,唐建平,中央音乐学院作曲系,音乐创作;礼乐文化;舞蹈交响化;,"本文从音乐创作的角度对张建民导师工作坊《礼乐魂-眷顾的诗情》进行艺术创作分析。《礼乐魂》中的音乐部分,是由笔者在1994年纪念孔子诞辰2545周年创作的琵琶协奏曲《春秋》。文中阐述了音乐创作过程中如何理解""礼乐文化"",以及如何用音乐的手段呈现编导个人的艺术表达,从而达到音乐创作与编导舞蹈创作在风格上的完美统一。",北京舞蹈学院学报,2018-08-31,期刊,J618;J632.33,118-120,3
65,回溯·展望·反思——“舞蹈高等教育四十年”专访,本刊编辑部,O,O,"<正>一、""舞蹈高等教育需要提高文化层次""——吕艺生访谈~①我在学院的领导岗位上十多年,我是这样思考舞蹈学院问题的。因为北京舞蹈学院(下简称舞蹈学院)是从中专改制转为高校的。我回到学校时,已经改制七八年了,1978年十月一号国务院批准的。舞蹈学院的基本结构,特别是思维,还停留在中专时代。这也是人们看到的,从中专过渡到大学,是在我担任院领导期间完成的。回顾起来从形式上,",北京舞蹈学院学报,2018-08-31,期刊,J70-4;G642,1-13,13
66,舞蹈影像创作中的重复、启示和转换,西蒙·菲尔德斯;张月龙,英国Goat Medsa公司深圳大学师范学院,舞蹈影像;屏幕舞蹈;剪辑;结构;,"本文概述了舞蹈影像和屏幕舞蹈在剪辑中重复镜头的使用特点,主要分析了以下三种方式:作为音乐结构手法的重复,作为建构叙述手法的重复和作为转换的蒙太奇式结构的重复,这三种方式都从不同程度反映出舞蹈创作和结构中的当代理论方法,只是后者试图探索一种常在音乐、文学、表演和视觉综合艺术中出现的重复性超脱感和精神体验感。",北京舞蹈学院学报,2018-08-31,期刊,J705,109-113,5
67,《中国古典舞身韵教学法(第3版)》出版,本刊,O,O,"<正>2018年6月,唐满城、金浩合著《中国古典舞身韵教学法(第3版)》由上海音乐出版社、上海文艺音像电子出版社出版。该书曾获北京市人民政府授予的北京市高等教育教学成果二等奖、北京市教育委员会颁发的北京市高等教育精品教材项目奖。本书第一作者唐满城先生,他把毕生的精力都献给了古典舞事业,可谓舞论宏富、研究深广,他更像是洇入土地的水滴,和""身韵""再也分不出彼此。身韵作为当代中国古典舞学科",北京舞蹈学院学报,2018-08-31,期刊,J722.4,37,1
68,《屈原》,,北京舞蹈学院科研处、图书馆,O,O,北京舞蹈学院学报,2018-08-31,期刊,J722.4;J42,129,1
69,舞蹈高等教育高峰论坛四题,于平,文化和旅游部,高等舞蹈教育;长江流域;民族舞蹈;舞蹈精品课程;,"2011年,自""艺术学""由高等教育的一级学科提升为学科门类后,隶属于""艺术学""的一级学科舞蹈学科备受关注。有关""舞蹈高等教育""问题的探讨,便自然而然成为当下舞蹈界的一大热门话题。本文从多维度切入""舞蹈高等教育""这一主题,指出当下高等舞蹈教育""同质化""趋势日益明显,并且正在成为一种既有学科模式的""弱化形态""。对此,笔者在观照长江流域高等舞蹈教育、民族舞蹈教学、舞蹈精品课程、区域性民族舞蹈教学以及民族舞蹈传承发展现状的同时,对该问题作出了思考。笔者认为""长江流域高等舞蹈教育""理念的提出便具有""在地化""色彩;民族舞蹈教学可基于某种""公约""的基础上实现""在地化"";舞蹈精品课程应关注其""转型定位"";区域性民族舞蹈教学则须处理好""既成风格""和""主体表达""之关系。",北京舞蹈学院学报,2018-08-31,期刊,J70-4;G642,17-24,8
70,中国舞蹈学研究生教育漫谈,江东,中国艺术研究院舞蹈研究所,中国舞蹈学;舞蹈高等教育;研究生教育;中国艺术研究院;,"1982年,时任中国艺术研究院舞蹈研究所所长吴晓邦开始为中国舞蹈界培养硕士研究生,开启了培养舞蹈学高端人才的航程。在中国舞蹈高等教育发展的四十年里,研究生教育筚路蓝缕,为我国的舞蹈学研究事业打下了坚实的人才基础。期间进步和欠缺并存,成长和挑战共融。中国舞蹈学研究生教育工作仍然是任重而道远的,唯有脚踏实地地布局和调整好基础性工作,才会让我们最终看到一个百花烂漫的美好未来。",北京舞蹈学院学报,2018-08-31,期刊,J70-4;G643,25-29,5
71,《德寿宫舞谱》考释与复现,刘青弋,上海戏剧学院舞蹈研究院,《德寿宫舞谱》;南宋宫廷舞蹈;舞蹈术语;考释;复现;,"宋代文学家周密在《癸辛杂识》后集中所记《德寿宫舞谱》,为在历史长河中销声匿迹的中国古代宫廷舞蹈留下了一份十分罕见且弥足珍贵的历史文献。对《德寿宫舞谱》的研究之于窥探中国古代宫廷舞蹈的面貌、术语系统、句式结构和舞蹈节奏,把握其艺术和审美特征,探究其对戏曲舞蹈的影响,都具有重要的学术价值。文章以史学研究与舞蹈动态还原操作实验相结合的方法,一方面通过考释证明齐如山等前辈研究成果的合理性,或纠正误读,或破译阙疑,使得舞谱的考释与破解获得新的进展;另一方面力求以多维的历史证据支撑,对舞谱进行动态复现,通过弥补中国古代舞蹈历史研究关于舞谱及其操作性研究的不足,探究宋代宫廷舞蹈的历史面目。",北京舞蹈学院学报,2018-08-31,期刊,J722.4,30-37,8
72,唐代胡腾舞形态考,李淼,河南师范大学音乐舞蹈学院,胡腾舞;考古图像;图像动作分析;,"胡腾舞是北朝异域艺术传入中原的特色舞种之一,其发展脉络体现了中国古代少数民族与汉民族文化的融合。通过对苏思勖墓、陕棉十厂唐墓及宁夏盐池唐墓壁画乐舞图像分析,进一步证明唐代经济和文化发展使得胡腾舞在传播过程中大量吸收了中原宫廷乐舞等文化元素,其服饰搭配和舞蹈动作更接近于中原宫廷乐舞,西域舞蹈的风格逐步弱化。目前学界对于考古图像中的胡腾舞、胡旋舞等舞种划分归属问题还存在争议,仅以旋转和腾踏作为胡腾舞和胡旋舞的区分标准有些过于模糊。",北京舞蹈学院学报,2018-08-31,期刊,J709.2;K879,46-51,6
73,彝族传统丧舞的源流、形式及其文化内涵,龙倮贵,红河学院,彝族;丧舞;源流;表现形式;文化内涵;,"彝族传统丧舞不仅有其传说由来,而且因居住区域不同而传承和发展各自不同,包括川滇大小凉山、滇黔乌蒙山、滇桂黔六诏山、哀牢山等不同类型和流派,并且都明显带有生者对死者的感情追思和功利目的。丧舞既是为亡灵顺赴阴路回归祖魂世界,又告示历代祖魂前来迎接新亡魂归祖,与历代祖魂一起生活。作为世间与祖魂之间""迎来送往""的直接反映,丧舞具有为亡魂在归祖途中铲除妖魔鬼怪,颂扬死者生前功绩,以及善舞娱人、崇祖悦祖、告慰亡灵,慰藉孝子孙等多重内容和功能。",北京舞蹈学院学报,2018-08-31,期刊,J722.29,52-58,7
74,彝族传统丧葬仪式舞蹈探析,沙呷阿依,中央民族大学舞蹈学院,彝族;丧葬仪式;舞蹈;,"云贵彝族丧葬仪式舞蹈蕴含着感恩、传德与教化的传统。本文从民族舞蹈学视野考察彝族丧葬仪式舞蹈,探讨彝族感恩传德与教化传统仪式舞蹈本体的艺术构成和文化特征,从中可以看出其舞蹈形式的丰富性与多样性,内涵寓意深刻。彝族丧葬仪式通过其在不同场域对生命和死亡的深刻理解和演绎,对参与者在社会角色与文化身份上的认同与转换产生巨大影响。研究彝族传统丧葬仪式舞蹈对研究彝族民族历史和民俗变迁,对其民族文化的当代创造性转化与发展,有不可替代和不可估量的学术价值。",北京舞蹈学院学报,2018-08-31,期刊,J722.29,66-70,5
75,新媒体时代背景下舞蹈艺术的表达,潘晶,山东艺术学院舞蹈学院,新媒体;舞蹈艺术;传播;呈现;审美;,"随着艺术领域的不断融合和数字化技术的发展,新媒体舞蹈成为一股新鲜的血液,为舞蹈艺术的发展带来更多的可能。新媒体舞蹈艺术的传播领域涉及电影、电视及微信、微博等平台,与传统舞蹈相比更注重虚拟化手段带来的冲击力。新媒体舞蹈扩展了传统舞蹈的表现空间,也为舞蹈的审美营造出非一般的视觉效果,同时为舞蹈的传承与发展带来更多的机遇和挑战。",北京舞蹈学院学报,2018-08-31,期刊,J705,91-94,4
