13,解开古典诗词意蕴的“密码”——《中华古典诗词比兴转义大词典》之功用,朱世东;陶沙,中国关工委,O,"<正>最近,某著名电视主持人在谈到对战时,脱口说出""一树梨花压海棠""的诗句。此句诗据传出于苏轼的《戏张先》。由于主持人不了解这句诗中""海棠""的含义,竟在大雅之堂说出并不文雅的话来,不能不令人咋舌!这里的""海棠""到底是何义呢?翻开东北大学出版社出版的《中华古典诗词比兴转义大词典》(以下简称《比兴大词典》)第447页-448页,便找到了答案:""海棠:蔷薇科落叶乔木。多春季开花。白色或淡粉红色。另有垂丝海棠,花色淡红,常半重瓣,花梗细长,下垂,称‘醉美人’。""它有三项比兴义,其一为""喻美人或少妇""。宋代释惠洪《冷斋夜话》云:",博览群书,2018-12-01,期刊,I207.2,65-67,3
14,古典诗词比兴研究漫论,刘继才,沈阳师范大学,O,"<正>中华文化自古以来就有一种具象类比的思维传统。据《周易》载,早在上古伏羲时代,就在天、地、人三才万物之间,""近取诸身,远取诸物"",并根据""观物取象""""立象以尽意""的基本思路,始作""八卦"",初创了中华文明。后来,《诗经》《楚辞》的创作与批判所遵循的""比兴""之义,便是这种思维方式在文学领域的一种具体实践。因此,有人认为,中国诗道之成,就是立足于""近取诸身,远取诸物""。但是,当初儒门的""比兴""概念是",博览群书,2018-12-01,期刊,I207.2,68-71,4
15,《剑桥倚天屠龙史:2018全新修订精装版》,新垣平,O,O,"<正>《剑桥倚天屠龙史》是新垣平博士致敬金庸大师之作。他创造性地将《倚天屠龙记》中的人物故事和中国历史完美结合。用""剑桥史""的写作手法,科学的考证,奇妙的想象丰满了金庸武侠世界的全貌。用详尽的史料和推理将金庸武侠世界真实全面的展现在了读者面前。将历史和武侠完美地熔为一炉。金庸作品中未提及的现实背景,",博览群书,2018-12-01,期刊,I207.42-5;K23-5,71,1
16,体会“大处着眼,,北京大学中文系,O,"<正>第一次听孙玉文老师教诲是在2010年。那时我读本科二年级,录取了北京大学古典语文学项目,选择古代汉语方向。孙老师是教研室主任,他把我们几个同学聚在一块,讲了两个事情:第一件,王力先生高小毕业之后,做了几年家庭教师,熟读学生家中所藏14箱古书,奠定了扎实的国学根基;第二件,""文革""以后王力先生给学生讲""如何读书"",不能只陷在一个很小的领域中,要广泛地阅读。孙老师随后介绍说古代",小处着手”——“孙玉文师生话论文”之六,雷瑭洵,博览群书,H109.2,109-110,2
18,我在北大指导的博士论文——“孙玉文师生话论文”之一,孙玉文,北京大学中文系北京文献语言与文化传承研究基地学术委员会中国修辞学会中国训诂学会中国音韵学会,O,"<正>1978年,我国恢复了中断12年的研究生制度,迄今整整四十周年。40年来,我国研究生工作不断前行,成就斐然,培养的研究生成为我国高等教育和科研工作最主要的力量,也成为其他各行业的骨干人才。一批批学子接受研究生教育,在文化建设的大潮中成为弄潮儿,作出重要贡献,谱写历史新篇章。可以预期,四十年前恢复研究生制度的举措必将永垂青史。我本人是这一制度的见证人和受益者。我原来工作的单位是湖北大",博览群书,2018-12-01,期刊,H109.2,98-100,3
19,我写博士论文的那层深意——“孙玉文师生话论文”之二,李建强,中国人民大学国学院,O,"<正>2003年我有幸进入北京大学中文系,在孙玉文老师门下读博士。2006年底博士论文通过答辩。现在回顾起来,三年多的时间,孙老师不仅传我绝活,而且注重性格的磨炼和长远学术规划的绸缪,是学术道路的领路人。当时汉语上古音领域正在进行十分激烈的争论,涉及复声母、汉藏比较、上古音研究的材料、方法等重大问题。照我的个性,遇到矛盾纷争宁愿绕道走;但是孙老师鼓励我要敢于迎接挑战,积极参与学术论争,在",博览群书,2018-12-01,期刊,H111,101-102,2
21,这些现象促使我早日把论文出版——“孙玉文师生话论文”之四,郑妞,上海大学文学院,O,"<正>还记得那是2007年,我在硕导骆瑞鹤老师的带领下,借孙老师在武汉开会的机会,第一次拜见了孙老师,并表达了我想考博的愿望。一路走回珞珈山庄,我说我正在整理谐声字,孙老师用他特有的语气提高了语调说:""好!""本来对考北大还忐忑不安的我,顿觉好像被注入了一股真气,信心大增,2008年能够顺利考入北大,离不开当初孙老师的肯定与鼓励。但当我成了孙老师的门下弟子,跟孙老师提博士选题的时候,孙老师却让我先放一放,叮嘱我要",博览群书,2018-12-01,期刊,H11,105-106,2
22,这是劳人心苦筋骨的活儿——“孙玉文师生话论文”之五,万群,北京师范大学文学院,O,"<正>上古汉语中有这样一类现象:""请勾践女女于王,大夫女女于大夫,士女女于士。""(《国语·越语上》)句中""女""既指称女儿,又陈述将女儿嫁给某人的行为。该现象涉及彼此紧密相关的两个重要课题:上古汉语名动词类的区分、上古汉语名动转类现象。我的博士论文《〈国语〉名动关系研究》以此为研究对象,以先秦重要典籍《国语》为基本语料。从博士二年级选题到论文完稿,其间自有一番苦乐。我最深的感受是,做论文是劳人心志筋骨的",博览群书,2018-12-01,期刊,H141,107-108,2
23,徐悲鸿收藏的古画——“名家的收藏”之三,佟刚,徐悲鸿纪念馆,O,"<正>徐悲鸿是我国现代的美术先驱、杰出的画家和美术教育家。而许多人不知道的是,徐悲鸿也是一位艺术品鉴赏家和收藏家。徐悲鸿一生收藏了上千件中国历代绘画书法作品,其中有晚唐五代时期的手卷、宋代的人物故事画、明代中期宫廷画家的花鸟画、明四家的山水人物画、清代扬州八家的作品、晚清任伯年的多幅精品以及王铎、傅山、伊秉绶等明清多位书法名家的书法作品。1953年徐悲鸿去世后,他的夫人廖静文按照他的遗愿,将这些藏品悉数捐献给国家,成为国家的珍",博览群书,2018-12-01,期刊,J212,88-95,8
24,"砥砺思想,宁静心灵——我送《博览群书》",,O,O,"<正>已经很久了,始终没有忘记送我离校时您深情的目光,始终没有忘记作业本上您那句鼓励的评语,始终没有忘记您的那门课一直托举我的成功。总想为母校做点什么,总想为您做点什么。老师,请接受这本《博览群书》,我的心意。本刊现协助爱心人士向母校教师赠阅《博览群书》。",博览群书,2018-12-01,期刊,+,130,1
25,不跟风,,O,O,"<正>邮发代号:82-248 (人物·综合版)订阅价格:180元(全年12期)2015年创刊,两年时间迅速形成""因思考,而不同""的办刊特色;作为中共中央主管的教育主流宣传阵地,我们忠实记录下为教育事业做出突出贡献的人和事;我们是教育宣传者,更是教育发现者和参与者。2018,我们愿与您一同见证一个教育大国向教育强国迈进之路上的点点滴滴。",做忠实于内容的教育守望者,,博览群书,+,2,1
26,《中华玄机》,王蒙,O,O,"<正>《中华玄机》是王蒙解析中国传统文化的新作,从主导中国人思维方式与行为习惯的角度入手,深入浅出地逐一解析。修齐治平、内圣外王、斯文济世、天下归仁、无为而治、以退为进、过犹不及、物极必反……孔孟老庄谈笑风生,古往今来纵横捭阖,书里书外雅俗共赏。既能给国人以文化自信的底气、豪气,又暗含知行合一、人生精进之指引,浸透",博览群书,2018-12-01,期刊,G122-5,123,1
27,传递阅读力量,,O,O,<正>江苏省启东市北新镇人民政府向读者赠阅2018年《博览群书》杂志。深圳市宝安区城管局向读者赠阅2018年《博览群书》杂志。中航信托股份有限公司为团员青年订阅2018年《博览群书》杂志。中国银行燕郊分行向华北科技学院师生赠阅2018年《博览群书》杂志。中国银行三河支行向廊坊燕京职业学院师生赠阅2018年《博览群书》杂志。,建设书香社会,,博览群书,+,128,1
28,史学的“问题导向”可能是歧路,陈来虎,中国社会科学院研究生院近代史系,O,"<正>《博览群书》编辑部:当前,""理论""与""问题意识""在史学研究领域屡被提及,备受关注,大有一股视""理论""""问题意识""为律之四海而皆准之风气。尤其是近年来,一些来自域外的作品动辄受到国人热捧,其一个直观的原因在于这些作品往往能鲜明地体现出一种理论的色彩、问题的意识以及叙事的故事化。不可否认,史学研究需要有""理论""滋养,也要",博览群书,2018-12-01,期刊,K06,113-115,3
29,一战期间的中国外交——“一战百年启示录”之一,侯中军,中国社会科学院近代史研究所,O,"<正>1914至1918年的第一次世界大战,其战场主要是在欧洲,中国虽然地处远东但仍在1917年3月14日对德绝交,继而对德宣战,成为一战的战胜国之一。一战爆发时,民国初建,国内政局不稳,袁世凯急于扑灭革命力量,建立自身的集权统治;国际上,英俄日等列强争相在中国边疆挑起事端,意图乘机获得更大的侵略利益。在复杂的国",博览群书,2018-12-01,期刊,K143;D829,5-10,6
30,中国面对“英日同盟”的阴影——“一战百年启示录”之二,马建标,复旦大学历史系中国社会科学院近代史研究所,O,"<正>所谓""英日同盟的阴影""是解释在""英日同盟""(1902-1923年)存续的21年期间,中国从清末到民初,经历了清帝国的崩溃和中华民国的建立,该同盟对这一时期的中国内政、外交造成什么影响,对东亚世界秩序造成何种影响。/壹/今天,我们回顾过去一百多年的东亚国际关系史,可以认为,缔结于1902年的""英日同盟""是以中国为主导的东亚体系解体之后的一个过渡时代的产物。甲午战争之前",博览群书,2018-12-01,期刊,K143,11-15,5
31,冷观一战中的美国——“一战百年启示录”之三,邵声,中央党校文史教研部,O,"<正>关于第一次世界大战与美国的关系,中国国内过去介绍较多的是美国对于第一次世界大战的发展进程和结局的影响,以及第一次世界大战之于美国的经济发展和国际地位的作用,而很少谈及第一次世界大战对于美国国内历史进程的影响。事实上,第一次世界大战在美国国内历史的走向上具有转折意义,它标志着一个时代的终结和一个新时代的开始。第一次世界大战爆发之时,美国国内正处在进步主义运动主",博览群书,2018-12-01,期刊,K143,16-20,5
32,一九一八年中国思想界的“三岔口”——“一战百年启示录”之四,王学斌,中央党校(国家行政学院)文史教研部中国史教研室,O,"<正>近代以降,特别进入民国,""西方""俨然已化为一个国人心头爱恨交织的强势词语,驱之不能,学之且难。然1918年却成中国人重新审视西方尤其欧洲文明的拐点。是年年底,梁启超赴欧参加巴黎和会。沿途梁氏穿过欧洲诸国,与随行记者一道考察第一次世界大战之西部战场、莱茵河右岸、比利时布鲁塞尔等地,足迹遍及比、荷、瑞、意、德等国,",博览群书,2018-12-01,期刊,K143,21-25,5
33,回望《四镇三关志》的磨砺,彭勇,中央民族大学历史文化学院,O,"<正>地方志综合记载一地区的自然、地理、沿革、制度、经济、军事、文化、人物、生活、灾害等诸方面,或专记某一类史事,不仅为研究区域史者必读,也是研究国家与社会之关联的重要文献,历来为治明清史者所重。本人研读明清历史30载,一直把地方志作为最重要的史料之一,长期使用前辈学者、同行提供的诸如缩微胶卷、影印、整理、点校、校注等不同形式的方志文献。这次自己主持校注《四镇三关志》的重要原因,第一它是我关注十多年的一部珍贵方志,我知道它的重要价值,它值得我下功夫去做;二是我曾认真阅读并加以利用过这部文献,也曾做过",博览群书,2018-12-01,期刊,K29,42-44,3
34,这是上乘的明代边关志书校注本——读《四镇三关志校注》,陈梧桐,中央民族大学历史文化学院,O,"<正>临近中秋之际,彭勇教授送来他和崔继来博士合作的《四镇三关志校注》(中州古籍出版社2018年6月出版)。拜读之后,有以下三点感想。具有重要史料价值的《四镇三关志》我国的地方志浩如烟海,据《中国地方志联合目录》的统计,截至1949年,我国存世的地方志就多达8300余种。限于人力、物力和财力,目前尚不可能对每种地方志逐一进行整理校注,只能首先选择其中最有价值者进行整理校注。明人",博览群书,2018-12-01,期刊,K29;G256.3,37-41,5
35,《清代社会生活史》,林永匡;王熹,O,O,"<正>清代是中国由封建社会向半殖民半封建社会转变的发端。在这一历史时期,社会经济发展,文化日臻繁荣,各民族进一步融合,法制日渐完善,宗教活动对社会的影响日益增加,人民的社会生活方式与风尚随之发生变化,呈现出新特点、新风貌和新变化。这些变化体现在服饰、饮食、居住、出行、婚嫁、丧葬、生育、娱乐、宗教、商贸等各个方面,并随着",博览群书,2018-12-01,期刊,K249-5,41,1
36,《吴晗说明史》,吴晗,O,O,"<正>吴晗是明史研究的著名专家,他于20世纪40年代著《明史》于昆明,原为四章,即收入该书的第一、四、五章,缺《军与兵》一章。此次出版增补了《朱元璋的统治术》《明初的恐怖政治》《明代的军兵》《明代的新仕宦阶级》等力作,与前三章基本可构成一部完整的明史,大体可窥见明代历史全貌及其特点。这是该书稿首次以单行本",博览群书,2018-12-01,期刊,K248-5,80,1
37,《安史之乱:大唐盛衰记》,石云涛,O,O,"<正>要读懂唐朝,先要读懂安史之乱。这场战乱,结束了盛唐的神话,百年帝国从此走上下坡路,一去不回头。往昔的繁华,成为回忆;战争的创伤成为唐人难以治愈的心灵之痛。是谁埋下了祸根?是谁点燃了硝烟?是谁在苦撑危局?又是谁在推波助澜?一场长达七八年的战乱,导致了怎样的力量重组、政坛变化?暴露了怎样的人情与人性?该书通过",博览群书,2018-12-01,期刊,K242.205-5,97,1
38,"丰子恺:“子恺”是名、号,还是字",葛云波;徐莉,人民文学出版社,O,"<正>丰子恺(1898—1975),现当代教育家、漫画家、散文家,尤其因漫画而妇孺皆知。但是,""子恺""或以为是名,或以为是号,或以为是字,莫衷一是。/壹/目前对于""子恺""的认识有三种:一种认为是名,第二种认为是号,第三种认为是字。持第一种认识者,典型的是丰子恺的子女。丰陈宝、丰一吟主编《丰子恺漫画全集》书前《年表》""1915—1917年""条提道:""(浙江省立第一师范学校)国文老师单不厂为丰仁取名子,后改为子恺。""",博览群书,2018-12-01,期刊,K820.9,27-32+26,7
39,探问家风——从《家风十章》到《家风十日谈》,王正,中国社会科学院哲学研究所,O,"<正>2018年初,欣闻李存山先生主编、吴小龙责编、笔者参与撰述的《家风十章》,入选为国家新闻出版广电总局全民阅读活动组织协调办公室主办的2017年度""大众喜爱的50种图书"",不禁十分惊喜。所惊者,这样一本正本清源而具有一定学术性的著作,竟会被大众所喜爱并入选;喜者,国人对传统文化之热爱、对优良家庭之渴望,正在日益加强。两者相结合,正可见家风这一看似遥远的事物,其实并非缥缈之物,它仍扎根",博览群书,2018-12-01,期刊,B823.1-5,59-61,3
40,《人间正是艳阳天:湖南湘西十八洞的故事》,彭学明,O,O,"<正>湘西十八洞是党中央首次提出精准扶贫重要思想的地方,该书讲述了各级领导干部与十八洞村民一道,积极响应党中央的号召,将大山深处积贫落后的边远村寨,逐步建设成因地制宜、合理规划、精准扶贫、精准脱贫的模范村的故事。作者彭学明五年八次实地走访,从十八洞一个个鲜活的身边事例入手,展现一系列政策措施在乡间村里的具体施行,以",博览群书,2018-12-01,期刊,F323.8-5,64,1
41,此文对全民阅读有启示,韩星,中国人民大学国学院,O,"<正>杨阿敏的《向郑板桥学读书》对郑板桥读书之道的论述颇有可观之处,文章总结了郑板桥在读书上的一些独到见解,一是反对所谓的过目成诵,强调熟读深思;二是强调精读的重要性;三是认为读书必须首选经典;四是读书要有特识,有自己的主张;五是对读书救贫的思考。论点鲜明独特,对当下的全民阅读活动不无借鉴作用。郑板桥的读书观深刻影响了他对文章之道的理解,他认为文章有大乘法,有小乘法:",博览群书,2018-12-01,期刊,G792,127,1
42,“鲁迅采集的植物标本”解读——“名家的收藏”之一,钱振文,北京鲁迅博物馆,O,"<正>在北京鲁迅博物馆一楼展厅,可以看见鲁迅在杭州浙江两级师范学堂任教时的一件植物标本木槿和鲁迅1910年3月采集植物标本的记录册。这件展品下面的说明是:""鲁迅采集的植物标本"",但这件标本左下角原有的标签上却有""蒋谦制藏第号""字样,采集地为""西湖岳坟"",采集时间为""己酉年七月""。实际上,除了这件木槿,北京鲁迅博物馆还收藏了另一件植物标本马蓼。马蓼标本的制作收藏人同样也是""蒋谦"",但采集地为""西湖"",采集时间为""己酉年八月""。",博览群书,2018-12-01,期刊,G894,76-80,5
43,郭沫若收藏物品四五件——“名家的收藏”之二,张勇,中国社会科学院郭沫若纪念馆,O,"<正>收藏是古代文人雅士的重要生活趣味,既反映了他们广博的学识体系,又彰显了个人独特的文化魅力。在现代知识分子中,郭沫若虽然算不上是一个收藏家,他的收藏物品,并不如鲁迅对版画和刻本收藏的专而精,也不如徐悲鸿对绘画作品收藏的多而广,但就他的收藏物品的动机和种类来讲,更具有生活气息和独特个性,收藏对于我们全面认识和还原一个真实的,具有丰富情趣追求的晚年郭沫若同样必不可少。/壹/郭沫若的收藏活动主要集中于中华人民共和国成立后,他定居于北京的岁月中,也就是他的晚年期",博览群书,2018-12-01,期刊,G894,81-87,7
44,越剧之美与绍兴酒香,郭梅,杭州师范大学,O,"<正>无论到没到过绍兴,中国人都知道,到绍兴必须做的事情里面,除了拜谒鲁迅故居,品一品孔乙己的心头爱物绍兴酒——也就是曹公雪芹喜欢的南酒,还有就是听一听绍兴戏了——现在,新昌调腔自然是难得听到了,而绍剧,就是质直激昂的绍兴大班,熟悉它的观众也很少,在全国有影响的绍兴戏曲,首推越剧。众所周知,越剧是发源于浙江的地方戏,它与浙江地方文化,尤其是浙东文化息息相关,在越剧清丽的声腔中,就有浓浓",博览群书,2018-11-01,期刊,J825;TS971,90-96,7
45,古今大家写“知己”——“名作与友谊”之二,林继中,闽南师范大学(原漳州师院),O,"<正>唐诗中写友情者可谓汗牛充栋,美不胜收,而意义涵盖最广者似当推王勃名句:""海内存知己,天涯若比邻。""不难发现,这句的""出处""是曹植《赠白马王彪》:""丈夫四海志,万里犹比邻。恩爱苟不亏,在远分日亲。""同样的意思,曹诗表达略显散乱重沓,而王诗借助唐代已成熟的格律,将曹诗的意思压缩在十字之中,更为显豁,且朗朗上口。再者,曹诗是写给弟弟的,表达的是血缘亲情;而王诗是送给同为宦游",博览群书,2018-11-01,期刊,I207.22,8-10,3
46,曹植诗作对友情的参悟——“名作与友谊”之三,杜志强;常艳霞,西北师范大学文学院,O,"<正>曹植(192—232)字子建,我国古代著名文学家,其作品感情浓烈,文采华美,是六朝时期举世公认的文学高峰,被誉为""建安之杰""。他性格热情,待人真诚,留下了丰富的交友作品(有28篇相关诗赋)。这些作品真切地反映了曹植对友情的珍视和赞誉,体现出纯美的人情和忠诚的交友品格。日本学者吉川幸次郎认为,曹植诗对友情的赞美,发现了友情对人生的意义,具有划时代的文学史意义(吉川幸次郎著,章学诚译:《中国诗史》,安徽文艺出版社1983年版,P130)。",博览群书,2018-11-01,期刊,I207.22,11-14,4
47,《长恨歌》的主题不是爱情,王志清,南通大学文学院,O,"<正>《长恨歌》因为写得太凄美了,感天动地,曲尽情致,使特殊的男女情事,获得了普泛性的意义,而让人当成一种表现美丽爱情的""风情""来欣赏了。本意并非美化李杨而歌颂爱情的《长恨歌》,也因为其""侈丽宏衍""的审美特质,而让人误读为一首爱情诗,一首歌颂爱情的诗,认为""爱情是《长恨歌》的第一主题""。为什么《长恨歌》不是爱情主题的诗呢?",博览群书,2018-11-01,期刊,I207.22,107-111,5
48,苏轼与陈的逆旅同游——“名作与友谊”之五,刘阳杰,西北师范大学文学院,O,"<正>苏轼,字子瞻,号东坡居士,四川眉山人,北宋著名文学家、书法家,中国文化史上的一位""通才"",其在文学、书法、绘画、哲学等诸领域精深的造诣对中国文化产生了深远的影响。陈慥,字季常,号方山子,又号龙丘居士,北宋名臣陈希亮第四子,苏轼毕生的好友。苏轼与陈慥的交往,是苏轼一生中极为重要的一段友谊。二人相识于苏轼任凤翔签判时,那时的他们少",博览群书,2018-11-01,期刊,I206.2,18-21,4
49,在蔡邕与汉魏士人之间——“名作与友谊”之四,宋亚莉,青岛大学文学院,O,"<正>蔡邕(133—192)生于汉顺帝阳嘉二年(133),字伯喈,陈留圉人。蔡氏家族在汉代极有声望,蔡邕十四祖蔡寅,六世祖蔡勋,父蔡棱皆名载史册。蔡邕主要活跃于桓帝、灵帝时期,他不仅师从当时经儒大师,还与诸多名士尤其是经学传人交好,更对后学提携举荐,不遗余力,故顾炎武说他""文采富而交游多""(《日知录·两汉风俗条》)。",博览群书,2018-11-01,期刊,I206.2;K23,15-17,3
50,晚年孙犁的人格与作品,杨振喜,河北省作协河北省文学学会,O,"<正>孙犁是河北安平县人,1913年生,2002年逝世,享年90岁,从事文学活动60余年。从创作上讲,以""文化大革命""为界,可分前期与后期,前期自1938年至1966年,以小说创作为标志,有一个长篇:《风云初记》、二个中篇《村歌》《铁木前传》、三个短篇集《白洋淀纪事》等。还有诗集、散文集及杂著。他是以小说""圣手""闻名。后期,自1977年至1995年是又一个高峰,每年出版一本新作,其代表",博览群书,2018-11-01,期刊,I206.7,97-102,6
51,如果学人都把论著写成论笔——读梁归智《浪子风流说元曲》,赵勇,北京师范大学文学院北京师范大学文艺学研究中心,O,"<正>/壹/今年9月,陕西师范大学出版总社一下子推出梁归智先生的两本新书:《禅在红楼第几层》和《浪子风流说元曲》。我刚读了第二本,便忍不住要信笔涂鸦,想说说我的感受了。这个感受需要从我的大学时代谈起。上个世纪80年代中前期,我在山西大学中文系读书,古代文学课分成四段,分别由四位老师主讲。讲到元明清文学时,梁归智老师出场了。梁老师是姚奠中先生的高足,姚先生又是章太炎先生的关门弟子,这种学缘关系本身已让我",博览群书,2018-11-01,期刊,I207.24,81-86,6
52,编《孙犁读本》的特殊情感,梁东方,花山文艺出版社,O,"<正>花山文艺出版社最近推出的《孙犁读本》,一套10种,包括《孙犁抗日文学作品选》《孙犁诗歌剧本选》《孙犁评论选》《孙犁书信选》《孙犁作品·少年读本》《孙犁作品·老年读本》《孙犁晚作选》《孙犁论读书》《孙犁论孙犁》《孙犁名言录》。这套书由孙犁的女儿孙晓玲撰写长篇序文,并与资深编辑专家李屏锦先生共同主编。孙犁是中国现当代文史上最重要的作家之一。他写作的审美视角与其终生坚持的""写真话、写确有所感的话""的原则,使其创作在整个现代文学史中,尤其在新中国的",博览群书,2018-11-01,期刊,I206.7,103-106,4
53,时时处处的清华人文,马利国,廊坊燕京职业技术学院,O,"<正>近日,有幸拜读了《新清华》发表的《你我就是清华人文》一文,文中董山峰学长珍贵的回忆不禁带我打开记忆的闸门,尤其是他对清华人文的思考也点亮我思想的火花。时至今日,清华在人们心目中仍然是典型的理工科大学,很多清华校友也戏称是""五道口理工""毕业的。理工给人的感觉是公式化、格式化和标准化,枯燥乏味,严谨有余而激情和浪漫不够,似乎和人文风牛马不相及。清华大学校长邱勇老师在",博览群书,2018-11-01,期刊,I267,112-115,4
