7,从“新浪漫主义转向”到“后启蒙”时代——改革开放40年中国文艺观的嬗变,金永兵;王佳明,北京大学中文系,新浪漫主义;新启蒙;后启蒙;新现代性;文艺观;,"近40年来,中国文艺观和文艺理论结构的转换,若以1992年市场经济正式确立为时间节点,大致经历了两个主要阶段,其一是强调审美自由的""新浪漫主义转向"",其二是""后启蒙""时代对自律化的现代性批判。在我国1980年代的语境下,""审美""更接近于浪漫主义而非启蒙主义,它诞生于对以""阶级论""为核心的政治理性的反抗之中,试图以具体的""审美自由""来反拨抽象的""政治自由""。它既呼应同时也批判着政治上以""去政治化""的形式对""物质欲望""的肯定。政治上对物质的肯定,可以说是一种""新启蒙"",它并非强调人类感性的全面性,而是以对马克思主义的""物质实践""理论进行再阐释的方式肯定了世俗物质利益积累的合法性。1992年以后的""后启蒙""时代,抽象的""商品理性""逐渐取代了具体的""物质欲望"",物质需求中价值的具体性日益被抽象成了交换价值。此时文艺观中出现了两种新变:其一是一种意图在现代性话语内部通过强调""传统性""""中国性""等新核心价值来重塑价值观的尝试;其二是针对""后启蒙""时代产生的两种自律化倾向——文学试图通过市场化,远离政治干预,在商品理性中形成的自律;出于批判商品理性的目的,作家和文艺理论家对""文学性""的自律性坚守——所做的批判,这两种自律性话语模式都是现代性发展到极端的表现,""新左派""的译介、文化研究和后现代话语等新兴话语模式通过对话语自律化和价值自律化的反拨,试图为""后启蒙""时期的现代性困境寻找对策。",长江学术,2018-10-15,期刊,I206.7,33-53,21
8,两极性·末世论和黑白二分的世界观——鲁迅与中国文化的现代性转型,耿传明,南开大学文学院,鲁迅;两极化;末世论;灵知主义;摩尼教;现代性的激进化;,"鲁迅是传统天道世界观在西方冲击下崩溃之后中国知识阶层的现代精神趋向的代表。两极化态度、毁灭——再生的末世论以及依赖人类自我救赎的灵明救世论构成了鲁迅心灵世界的核心。传统天道的崩解使人与宇宙以及人与世界之间的亲和感、归宿感被人与宇宙之间的陌生感和人与世界之间的对立感取代;以我为主宰的扩张自我的两极化态度、由不满于现实到全面否定现实再到以尚未出现的""新世""作为人生支撑的末世论期待以及以自我为中枢和终极的灵明主义、英哲救世论,构成了鲁迅不同于传统的看待宇宙、看待世界以及看待自身的独特方式和态度。人与宇宙、人与世界以及人与自我之间对立的紧张性在鲁迅身上有充分的表现,其截然区分善恶、绝不妥协的立场,使其在零碎改良之外,开出必须在""苏生""和""毁灭""之间必选其一的极致性选择;这种与世俗化生存势不两立、清坚决绝的精神态度使其与以""灵""的超越性为主导、将代表人的社会性的""魂""和人的自然性的""体""视为人性的枷锁、对现实世界持整体性拒绝态度、追求自我救赎的西方灵知主义有相通之处;其与将一切现象归纳为善与恶、光明与黑暗之间的对立、将世界分为善恶两个本原的摩尼教也有相通之处。由这种截然区分善恶的二元敌对态度派生出一种现代性的激进化形态,将新与旧、传统与现代的冲突绝对化。",长江学术,2018-10-15,期刊,I210,67-79,13
9,论胡适新诗理论中的跨界式叙事——从“作诗须得如作文”的诗学命题谈起,姜玉琴,上海外国语大学文学研究院,新诗理论;胡适;诗学;跨界式;叙事;“作诗如作文”;,"在新诗理论初创之时,胡适曾提出过""作诗须得如作文""的诗学命题。长期以来,几乎所有的诗歌从业者都认为这是个""非诗""主张,会把诗歌的创作引入歧途。传统观念认为""诗""与""文""势不两立,然而,胡适却提出了一个不同文体间的相互引入与融合的美学转向问题。具体地说,胡适为了扭转""诗""愈来愈狭小、单薄的精神空间,决定把""文""的一些特长,诸如描写、叙事性汲取进来,从而扩大诗歌内在的表现力。这种把原本并驾齐驱的两种不同文体嫁接、融合到一起的实践,表明新诗的表达模式是一种跨界式表达模式,它既有传统诗歌的抒情性,又有了""文""的叙事性,形成了一种""抒情+叙事""的现代新手法。",长江学术,2018-10-15,期刊,I207.25,80-86,7
11,18、19世纪西方汉语教材中的文言虚词研究——以“以”的研究为例,王玥雯,武汉大学文学院,18、19世纪;翻译;语法;汉语教材;文言虚词;以;,"本文选取了三部代表18、19世纪西方汉语文言语法研究较高成就的著作为研究对象,以文言虚词""以""为对象展开个案调查,探求早期西方学者们如何以西方语法体系为参照,利用中国传统小学的研究成果,在翻译与交融中展开汉语文言虚词研究。我们的结论是,18、19世纪西方汉语教材中的文言虚词研究取得了惊人的成绩。这些成绩是西方语法体系与中国传统语文学经由翻译与对话、融合与创造而取得的,主要体现为:卓著的词类研究、开创性的句法研究、有意识的语法化研究和朴素的词汇化思想的萌芽。",长江学术,2018-10-15,期刊,H141,122-128,7
12,从Ten(sion)到“张力”:美学范畴“张力”的词源学谱系,王乾坤;张龙云,华中科技大学中文系,张力;美学范畴;词源学;谱系;,"作为审美概念之一的""张力""(tension)因其普遍使用而具有特殊意义,它不仅存在于科学领域,还运用于艺术领域。大多数观点都认为,美学""张力""源自物理。通过研究美学范畴""张力""词源学谱系,可以发现:美学""张力""的概念主要源于""张力""(tension)的原始意义""机体延展及心理紧张""。由于汉语构词法则和中文翻译的影响,""张力""概念原始的生理和心理意义被遮蔽,物理学意义过于突出,这一方面严重窄化了英语tension的多层涵义,另一方面严重泛化了它物理方面的含义,造成词源意义上的误解,并直接导致张力美之泛化判断。总之,就语词演化和美学""张力""的概念而言,只有在机体意义上的对抗才能带来生命动感与张力美。",长江学术,2018-10-15,期刊,H039,59-66,8
13,电影片名翻译的文化变译,王宇波;朱理桢,武汉大学文学院中国语情与社会发展研究中心哥伦比亚大学教育学院,电影片名;平行语料库;文化变译;方言;修辞;统计分析;,"海峡两岸及香港地区因电影制度、社会文化、审美习惯及价值取向等方面的不同,电影片名的汉译一直存在差异。本文把2016—2017年在中国内地、台湾地区和香港地区共同上映的114部电影译名建成平行语料库,通过详实的片名语料,分析了片名汉译的""一名多译""现象,从文化适应性的角度论证了""一名多译""现象的本质是共同遵循了文化变译策略,考察了文化变译策略下方言俚语和修辞手段的运用,并对新时期电影片名翻译提出了建议。",长江学术,2018-10-15,期刊,H315.9,109-115,7
14,关键词研究的理论模型与实践路径——跨文化视域下文化关键词研究的学术对话,黄保罗;李建中,赫尔辛基大学世界文化系武汉大学文学院,关键词研究;理论模型;实践路径;,"国学与西学的融通与交汇,是全球化时代中国学人的学术宿命。从上世纪的""文心""""诗性""到本世纪的""文化关键词"",中国古代文论研究一如既往地或吸纳或抵抗着外来文化:如何在""失语""与""独白""之间擘肌分理、唯务折衷,如何既坚守文化本位又借鉴他山之石。跨文化视域下关键词研究的理论模型建构、方法论探索及通识教育实践,或可为当下中国学术的进路提供新的思想与方法。",长江学术,2018-10-15,期刊,G122,17-22+24+23,8
15,当前世界与中国人文传统,涂经诒,罗格斯大学亚洲语言与文化系,中国人文传统;当前世界;环保;和谐;,"中国的人文传统历史悠久。""人文主义""这个词虽然不是中国创造出来的,但是""人文""这个词在中国很早就有了,人文思想在中国也得到了长足的发展。用中国的人文传统来看当前世界经常被热议的一些问题,可以发现中国的人文传统视角独特,内蕴丰富,不仅与这些问题毫不冲突,还可以为这些问题的解决提供一些可资借鉴的思路和方法。",长江学术,2018-10-15,期刊,B2,5-16,12
16,文艺复兴时期的英诗星空——《英国文学史》节选,H.A.泰纳;李旷远,武汉大学文学院,文艺复兴;英诗;种族;环境;时代;,"英国文艺复兴时期诗人辈出,诗歌,特别是田园诗,盛极一时且独标灵彩,其背后的深层原因是什么呢?法国文学批评家泰纳以种族、时代及环境三要素作出了令人信服的阐释。本节选即呈现其《英国文学史》的相关章节,特别是有关锡德尼、本琼森、马洛、斯宾塞和莎士比亚等绚烂的诗人群体的诗作,及其相应的撒克逊种族、自然环境和文艺复兴时代的特征,对这一时期的英国诗歌特别是田园诗的发生及其拓展的境界,赋予了别开生面的理解。",长江学术,2018-07-15,期刊,I561.072,89-97,9
17,马华旅台小说家笔下的原乡书写,金进,浙江大学中文系,马华旅台作家;原乡书写;国族认同;,"马华旅台作家是台湾文学中不可忽视的创作力量,其中又以小说创作为其最重要的成就。这些小说家身为华人的后裔,出生于马来西亚,大学留学在台湾,成名和就业也在台湾,可以说他们很好地融入台湾社会中。身处异地的小说家们笔下总有着挥散不去的原乡书写,本文以华语文学中的原乡概念入手,以他们所处的时代和主要作品为对象,分析他们对中国大陆、中国台湾和马来西亚三个华人聚居地的原乡情结,全面和细致地展示马华旅台小说家们的身份认同和创作精神,为我们研究世界华文文学提供一个复杂而生动的研究个案。",长江学术,2018-07-15,期刊,I338.074,98-111,14
18,现代学术评审制度的建立——国民政府教育部学术审议委员会与学术评奖,沈卫威,南京大学中国新文学研究中心,学术审议委员会;学术评奖;档案;,"学术评价体系的确立是国家学术话语形成的标志。这既是公平、公正学术环境的保障,也是学者学术尊严和荣誉的体现。抗战虽然艰苦决绝,但中华民族的学术精神和学术薪火,却一直在传递中迸发出强烈的光热。1940年国民政府教育部学术审议委员会形成,使得国家层面的学术评议、审议制度规范化、学理化。中国学术史上所谓门派家法,古今之争,汉宋之别;诗歌创作中宗唐宗宋、白话古体、雅言俗语;文学研究中义理、词章、考据轻重分别,都被体制化的规约所消解,呈现出特有的学术风范。从1941年至1947年的六次国民政府教育部学术审议委员会评奖,到1948年中央研究院院士选举,完成了由现代学术体制统领中国学术的大一统局面,民间学术个体或区域的学术群落,越来越边缘化。",长江学术,2018-07-15,期刊,K26;I206.6,35-48,14
19,主持人语:重读“红色经典”,赵学勇,陕西师范大学文学院,O,"<正>20世纪中国文学中的""红色经典"",是在延安文艺的体制规范与思想题旨中孕育生成,经由""十七年""文学在史诗叙述与美学范式等方面的践行,从而对80年代后的文学批评与艺术审美产生一定影响的特定文学评价体系。其中,""十七年""时期革命历史题材的叙事作品,被广泛纳入""红色经典""的范围之内,如""三红一创""""保林青山""等。就文学题材而言,农业题材与工业题材的作品极少进入""红色经典""的视野;就时间界定来说,""红色经典""的",长江学术,2018-07-15,期刊,+,49,1
20,《三里湾》中的“孝文化”,惠雁冰;左雨浓,延安大学文学院,《三里湾》;孝文化;乡土情结;,"传统伦理文化的精神根基是以家庭为原点的""孝文化"",赵树理的长篇小说《三里湾》与""孝文化""有着内在的关联。这种关联恰恰是赵树理小说""民族化""风格的显在表征,也是《三里湾》这个文本具有经典性、重读性的重要因素。小说中几位年轻人对""孝文化""的不同选择与呈现,既体现出赵树理对乡土文化传统的认同与守望,也体现出乡土中国在时代演进的过程中缓慢但有力的步履。正是这种浓重的乡土伦理文化情结,对赵树理的温情叙事模式产生了深刻的影响。",长江学术,2018-07-15,期刊,I207.425,50-57,8
21,"穿越历史之隔,感受作品之真——重读《乘风破浪》兼及“十七年”工业题材小说的再评价",田文兵,华侨大学文学院,《乘风破浪》;重读;叙事模式;文学史价值;,"对包括草明在内的""十七年""工业题材小说,一直评价不高。但重读草明的代表作《乘风破浪》可以发现,屡遭诟病的二元对立叙事模式,实际上有着传统现实主义文学的深远影响,是""赵树理方向""在工业题材领域的回应。创作中的情感叙事虽然隐喻了时代主题,但也表现出草明对个体情感的关注。应该穿越时代的隔膜,去真诚地感知作家创作的内心声音,不能忽视""十七年""工业题材小说的文学史价值。",长江学术,2018-07-15,期刊,I207.42,58-64,7
22,《诗经·鄘风·鹑之奔奔》的主题与春秋政治,李会玲,武汉大学文学院,《诗经》;《鹑之奔奔》;春秋政治;卿族;,"《鹑之奔奔》的主题不是讽刺卫宣公的淫乱家事,而是反映卫国卿族政治中""父子相杀、兄弟相灭""的社会现实。人们误解《鹑之奔奔》的主题有两个主要原因,一是《毛诗序》的导引作用,二是郑玄对""奔奔""""彊彊""的解释。根据""奔""""彊""的本义、古代斗鹌鹑习俗以及卫国历史,我们可以确知此诗的主题。先秦孔子引诗及伯有赋诗的语境也有力地证实了这一判断。",长江学术,2018-07-15,期刊,I207.22,73-78,6
23,佛教因明学对《文心雕龙》的影响探论,刘业超,湘潭大学文学与新闻学院,佛教因明学;文心雕龙;影响;,"以佛教因明学为特定视域,从显性的理论启迪与隐性的实践参照两个方面来看,佛教因明学对《文心雕龙》整体结构、论证方法与论证方式均具有重大影响。由此展现了一条重要的文化事实:在1500年前的""述而不作""的历史环境中,如果没有佛教因明学的理论启迪和方法参照,《文心雕龙》这一前所未有的""体大而虑周""的巨制的出现将是无源之水与无本之木,是不可想象的事情。这一文化事实证明了一条重要的真理:海纳百川,有容乃大,变则可久,通则不乏——这就是中华文化之所以经千年而不朽,历万劫而长新的历史原因,也就是其所以至今仍深受世人景仰的历史原因。",长江学术,2018-07-15,期刊,I206.2,79-88,10
24,“中国新诗(1917-1949)接受史研究”高端论坛成功举办,,O,O,"<正>由武汉大学文学院主办的""中国新诗(1917-1949)接受史研究""高端论坛4月26日举行。来自全国的新诗研究专家汇聚武汉大学,围绕国家社会科学基金重大项目""中国新诗传播接受文献集成、研究及数据库建设(1917-1949)""展开深入探讨。论坛由湖北现代人文资源调查与研究中心、武汉大学新诗研究中心以及项目课题组协办。武汉大学人文社会科学资深教授於可训主持开幕式,人文社会科",长江学术,2018-07-15,期刊,I207.25-2,129,1
25,在中国新诗百年纪念大会上的致辞:一百年来一件大事,谢冕,北京大学中文系,O,"<正>今天我们在北京大学阳光大厅隆重举行中国新诗一百年纪念大会。今年是戊戌维新一百二十周年,也是北京大学建校一百二十周年。这些重要的日子重叠在一起,给我们的大会增添了庄严的气氛。一百年前,即公元1917年,陈独秀就任北京大学文科学长,将《新青年》从上海迁来北京大学,当时的办公地点是东华门外箭杆胡同。移刊后的《新青年》刊登过""分期编辑表"",这些编辑依次是:陈独秀、钱玄同、高一涵、胡适、李大钊、沈尹默。这",长江学术,2018-07-15,期刊,I207.25,5-7,3
26,白话书写的音乐性实验:鲁迅的《野草》和《好的故事》,安敏轩;郑艳明,康奈尔大学亚洲研究系武汉大学文学院,鲁迅;散文诗;《野草》;《好的故事》;白话;诗的音乐;,"本文通过分析鲁迅的散文诗集《野草》《好的故事》中的韵律,论述了鲁迅梦想通过散文诗为白话创造一种新的音乐的原因和过程。鲁迅以波德莱尔式的散文诗作为自己语言创造的起点,在《好的故事》中营造了一个将诗的音乐融入白话的自由空间,为白话诗学的建构提供了一种方案。",长江学术,2018-07-15,期刊,I210.5,8-20,13
27,交叉的视野与异域的返观:美国华裔学者的鲁迅研究,李松;姚纯,武汉大学文学院江汉区文化馆,鲁迅;美国;华裔;汉学;,"从20世纪70年代开始,华裔汉学家成了美国鲁迅研究的主力并产生了很大的国际影响,代表性学者有夏氏兄弟、林毓生、李欧梵、王德威等人。这些留学海外的华裔学者,其独特的身份与经历形成了""以中观西""与""以西观中""的交叉视野;在异域对中国文学的返观包含思想的多源性,从而呈现出观点的多元性;身处理论生产大国,在观念上往往得风气之先;在思想相对独立的大学体制中,较少受非学术因素的干预;从学科属性而言,他们的研究既是美国区域研究的有机组成部分,又是西方文学理论应用于中国文学批评的实践。",长江学术,2018-07-15,期刊,I210,21-34,14
28,说“无比”,萧红,武汉大学文学院中国语言地理研究中心,无比;非典型修饰词;否定比较;语序;,"对学界已有对""无比""性质及其演变动因的研究进行重新审视发现:首先,按照袁毓林《汉语词类划分手册》为""无比""的功能赋值,现代汉语的""无比""属于不太典型的修饰词和副词,与动词、形容词无涉,最好看作是修饰词。其次,""无比""在其演变为修饰词的过程中表现出与其它否定比较词不同的特点。""无比""结构来源复杂,完整的发展阶段应包括(1)""无所比""中""所""脱落,形成""无比1"";(2)由""无所比""替换为""无+(NP+比)"",NP是代词或名词;(3)""无+(NP+比)""中主要成分缺省导致结构紧缩而形成新的""无比2""。",长江学术,2018-07-15,期刊,H14,112-121,10
29,上巴河方言的反复体,何洪峰,华中科技大学人文学院,体;反复体;语义;语法;上巴河方言;,"体表示动词或句义的内在时间结构。汉语语法学者对体的认识不一致,汉语方言动词体研究,不妨从宽一些。黄冈上巴河方言动词反复体比较丰富,语义上可以分析为6种类型:常规反复、随意反复、交错反复、快速反复、持续反复、虚指反复;语法性质上可以分析为3种类型:形态式反复体、半形态式反复体、半词汇式反复体。词汇式反复是一种非典型的反复体。",长江学术,2018-07-15,期刊,H172.4,122-128,7
30,歌剧《白毛女》与“讲故事的人”,王鑫,陕西师范大学文学院,《白毛女》;讲故事的人;集体经验;实用关怀;艺术“光晕”;,"民间故事""白毛女""与歌剧《白毛女》的流传史,在特定的历史时空下,可以与本雅明""讲故事的人""的理论视野发生关联。以歌剧形式表现的《白毛女》,聚合了集体经验与""实用关怀""的特征,延续了故事的生命,并在文艺传统的形式层面上被赋予""膜拜价值""。歌剧《白毛女》的情节线索、故事单元,在不同的感知方式和距离中,构成了文本意涵的丰富阐释空间,并在时代征候与社会功能的引入之下,呈现为意识形态信仰的另一种""膜拜价值""。形式与内容相统一的《白毛女》歌剧因此映现出独特的艺术""光晕""。",长江学术,2018-07-15,期刊,J822,65-72,8
31,长江学者,,O,O,"<正>徐杰,1963年生,河南人,美国马里兰大学语言学博士。现任澳门大学人文学院中国语言文学系汉语语言学教授、系主任,教育部""长江学者""武汉大学讲座教授。曾任新加坡国立大学中文系副教授兼助理系主任,华中师范大学语言与语言教育研究中心教授、楚天学者,河南大学兼职特聘教授及语言科学与语言规划研究所所长、黄河学者。主要研究领域为句法学、语义",徐杰,,长江学术,K825.5,2,1
32,晚清“翻译小说热”与中国现代文化产业的形成,韩晗,深圳大学文化产业研究院,晚清;翻译小说热;文化产业史;赞助人;,"晚清翻译小说借""西学东渐""之风入华,形成中国近代史上的""翻译小说热""。关于""翻译小说热"",学界多半在翻译史、文学史及中西文化交通史维度论析其特点与价值,而较少从中国现代文化产业史的维度进行分析。本文着重从晚清""翻译小说热""形成的原因入手,以勒菲弗尔的""赞助人""为视角,认为""翻译小说热""反映了稳定消费群体的形成与现代文化产业生产机制在现代中国的确立。因此,""翻译小说热""为后世中国文化产业的发展提供了重要的经验与坚实的基础并影响深远,是中国现代文化产业形成的重要标志。",长江学术,2018-04-15,期刊,G124;H059;I046,22-30,9
33,澳大利亚华人(华裔)文学述评,温卡·奥门森;卢秋平,澳大利亚伍伦贡大学文法艺术学院武汉科技大学外国语学院,澳华文学;华裔文学;身份;多元文化书写;,"最早的澳大利亚华人文学作品于20世纪之交发表在悉尼和墨尔本的华语报纸上,表达了对当时中国国内政治形式的关注以及对白澳政策的抗议。时隔几十年后,澳华文学于20世纪90年代重新繁荣起来,这是随着80年代移民政策开放,来自中国大陆新移民热潮以及留学潮的结果。用英语写作的澳洲华裔文学无论是从作者的背景,还是从作品的性质来看迥然不同。这些华裔作家有时置身主流文化之内,有时置身其外,采用创新手法书写身份和归属问题。澳华作家拒绝别人对他们的作品妄加分类,也不愿囿于华裔书写的传统主题,他们通过构思自我、声音、故事,书写多元文化、文学的传承和他们的人生经历,表现本地、(多)民族、全球视角交融的当代生活的复杂性。",长江学术,2018-04-15,期刊,I611.06,45-58,14
34,论宋代鼓子词的审美品格与文学渊源,陶然;姚逸超,浙江大学中文系浙江大学城市学院传媒与人文学院,宋代;鼓子词;审美品格;文学渊源;,"鼓子词是流行于宋代文人阶层的说唱伎艺,文人或直接参与其表演担任击鼓的角色。鼓子词开篇往往有致语,以叙述创作或表演契机,并统领其后的联章词作,有其重要的现场作用。鼓子词致语自产生之初,就有作为独立审美对象的规格与品质,其功能近于古代游宴序,在烘托氛围的同时抒发士大夫的雅兴与情怀。现存宋代鼓子词的题材集中于咏物、咏地域风土、咏时序节令、叙故事等方面,其中多有深厚的文学渊源。",长江学术,2018-04-15,期刊,I207.23,68-75,8
35,文学的价值结构和现代“革命文学”的价值结构,方维保,安徽师范大学文学院,文学;价值结构;革命文学;四维结构;,"艺术作为一种主体实践,其价值具有一个应然的结构。文学如所有的其他的艺术门类一样,也有着自己的价值结构。一般意义上的文学的价值结构被限定于文本及其审美,但中国现代""革命文学""的价值结构,却有其特殊性,它有着更为开放的结构形态。在价值哲学和文艺社会学的价值和价值结构理论的视野中,现代""革命文学""存在着一个四维的价值结构,即信仰价值的维度、文艺审美价值的维度、伦理情感价值的维度和社会文化价值的维度。",长江学术,2018-04-15,期刊,I206.6,76-85,10
36,思想勘探者的乡愁之书——论刘继明的长篇小说《人境》,阳燕,湖北大学文学院,《人境》;乡愁叙事;思想勘探;“大文学”;,"《人境》汇集了刘继明近二十年来的观察与思考,将知识分子叙述与底层叙述这两个作家最关切的题旨作了一次综合而深入的表达,乡愁是小说的基调与底蕴,思想则赋予小说价值与深度。本文认为,思想视野与乡愁叙事的交融,将《人境》谱写为乡村和城市、历史与现实、社会与人生、写实与抒情、叙事与象征的交响,践行了作者倡导的""大文学""的理想范式。",长江学术,2018-04-15,期刊,I207.42,86-93,8
