30,主体的黄昏——文艺个人主体性的消解与主体间性转向,金永兵,北京大学中文系,个体自我;主体性;主体间性;语言革命;象征寓言;意识形态幻象;,"从文艺复兴恢复了大写的""人""开始,个体自我意识就成为西方文学及理论的主要关注点之一。这一关注最终走上了两条道路,其一是消极的关注,它是以索绪尔语言学理论为基础,以结构主义、后结构主义、解构主义等为代表的,对文本中作为写作主体的""自我""的分析剖离;其二是积极的关注,它是以文学上的浪漫主义和心理主义等为代表的对""自我""的书写。前者的问题在于将""自我""逐步消解在语言和阅读快感之中;后者的问题在于:一方面,没有看到""自我""永远不可能只是个体性的,它不可避免地要有杰姆逊和荣格等人极力强调的公共层面,另一方面,在新资本主义或后资本主义的工业社会中,文学表达的更多的是意识形态的幻象,这是""自我""的另一种消亡形式。因而,无论是从文学角度,还是从文学所依赖的政治、经济和文化环境上来讲,都亟待我们在其中重构一种""主体间性""。这种""主体间性""带来的和谐之美,有可能解决日益严重的文艺个人主体性的消解问题。",长江学术,2017-04-15,期刊,I0,75-93,19
31,审美感通学批评的文艺学基础,汪余礼,武汉大学艺术学院,审美感通学批评;文艺本体论;文艺价值论;审美标准论;,"""审美感通学批评""区别于其他批评方法的独特之处,归根结底是源于对文艺本体、文艺功能、文艺创作规律、文艺审美标准等元问题的不同理解。在文艺本体论上,审美感通学批评认为文艺作品不只是""现实生活的反映"",而是现实生活、作者自我、审美形式三维耦合的结晶;其本体并不局囿于""形式"",也不在""生活""或""人类"",而存在于作者生命、作品生命、观者生命三者融会互动所形成的动态结构中。这个动态结构同时也最能说明文艺作品的创造之秘。文艺作品的创造本质上是一个""说不可说""的过程,是作家在对宇宙自然、社会人生、艺术创造本身有所感悟的基础上,调动诗性智慧进一步去深入探索、巧妙表现的过程;创作的关窍不在于""反映生活"",而在于""倏作变相"",以陌生化、合律化的形式传达个体深沉的生命体验。在文艺价值论上,审美感通学批评认为文艺的价值不限于认识、娱乐和教诲,而主要在于感动人心、感兴生命、增进共通感、成人之美(让人成为人并达到美的境界)和涵育创造性人格。在审美标准论上,审美感通学批评认为,文艺作品所传达的生命体验越是深厚独特,作品所渗透的诗性智慧越是丰富高妙,作品所采用的审美形式越是新颖和谐,其整体感通人情、拓展人心的力量越大,其艺术价值就越高。",长江学术,2017-04-15,期刊,I01,94-102,9
32,日本与马克思主义文艺理论中国化,黄念然;高越,华中师范大学文学院,日本;马克思主义;文艺理论;传播;中国化;,"早期日本马克思主义文艺理论在中国的传播,就其传播特征看,一、以""重译""、""转译""、""节译""、""转述""等为基本方式;二、日本""纳普""文艺理论和""普罗列塔利亚文学""成为译介重点;三、重视马克思主义基本原理对文艺的""触媒""作用。中国左翼文艺运动对早期日本马克思主义文艺思想如福本和夫的""理论斗争主义""、青野季吉的""目的意识论""、藏原惟人的""新写实主义""等的吸纳,为马克思主义文艺理论的中国化建构了政治和大众的关键两极,同时也带来一些负面影响,这些都为当下中国文艺理论界进一步探讨马克思主义文艺理论的中国化问题提供了反思的基础。",长江学术,2017-04-15,期刊,I0,48-55,8
33,论刘永济屈赋考据的人文性与科学性,陈文新,武汉大学文学院,刘永济;屈赋;考据;人文性;科学性;,"刘永济的屈赋考据,包括两种类型。第一类偏于人文性的阐发,常常并无铁证,如关于屈赋作品的认定和部分字句的改动;第二类则以科学性见长,包括屈赋的审音、训诂、语法研究等内容,他的几个主要成果,如《屈赋通笺》各卷的""正字""、""审音""、""通训""各节,以及《屈赋音注详解》《屈赋释词》两部专书,集中显示了他在考据和语言学方面的深厚造诣。其屈赋研究得到闻一多、游国恩等大家的激赏,主要是在第二个方面。",长江学术,2017-04-15,期刊,I207.22,56-64,9
34,借鉴与传承:也谈《二月》中的鲁迅因素,宋剑华,暨南大学中文系,《二月》;芙蓉镇;孤独者;新女性;孀妇劫;鲁迅因素;,"柔石的代表作《二月》,借鉴与传承了鲁迅精神,在空间背景、故事情节、人物形象等诸方面,都留有鲁迅的影子,以至于学界一致认为,《二月》同鲁迅的小说具有太多的相似性。通过仔细比较,发现《二月》的文化批判性,虽然力求去接近鲁迅经验,却远未达到鲁迅那样的思想深刻性。两者之间的这种差别,绝不能等同视之、一概而论。",长江学术,2017-04-15,期刊,I207.42,65-74,10
36,“1875年是现代文学的起点”——哈佛大学伊维德教授访谈录,吴锦华,莱顿大学区域研究所,O,"<正>采访时间:2012年2月17日采访地点:荷兰莱顿受访人简介:伊维德教授(Wilt Lukas Idema,1944—)是位传奇人物,以其研究的高效高质和广涉猎而闻名,曾被学生称呼为Mr.Know-It-All。他19岁入读莱顿大学汉学院,30岁即完成博士论文,时隔2年成为莱顿大学汉学院的教授,并兼任莱顿汉学院的院长。其研究领域涉及古代诗歌、话本小说、戏曲等,偶尔涉足中国现当",长江学术,2017-04-15,期刊,I206.6,5-9,5
37,西方哲学和中国现代文学批评:《红楼梦评论》,涂经诒;邓明静,罗格斯大学湖北大学,红楼梦评论;王国维;西方哲学;中国现代文学批评;,"王国维的《红楼梦评论》是将西方哲学与中国现代文学批评紧密联系在一起的开拓之作,其巧妙运用了叔本华的艺术理论来研究中国名著《红楼梦》,从深度和广度上论述了《红楼梦》的精神内涵、美学价值、伦理价值以及悲剧意识。在《红楼梦评论》中,王国维从生活之本质的角度出发探讨了《红楼梦》的哲学基础,认为《红楼梦》极度体现了人生的苦痛以及人不断追寻解脱之道,极具厌世解脱之精神,是一部举世瞩目的悲剧,完美展现了叔本华所谓的第三种类型的悲剧,因而被视作为""悲剧中的悲剧"",是""壮美文学""的代表,其美学价值与伦理价值密切相关。写于一百一十多年前的《红楼梦评论》在当时既倡导了一种研究《红楼梦》的新方式,也为中国现代文学批评提供了示范。",长江学术,2017-04-15,期刊,I207.411,32-39,8
38,唐诗中一字平上去三读而义同与义别相兼的问题,刘子瑜;刘宋川,北京大学中文系湖北大学文学院,唐诗;平上去三读;义同;义别;平仄律式;,"本文对唐诗中18个单字具有平上去三读而义同兼义别的音义关系和用法作了论析,认为:(1)根据各字同义而多音读的情况,可分为同义而有平上去三读或平上、平去、上去两读等四小类。从声律应用来说,诸字的同义而多音读基本上属于平仄两读,值得注意。(2)这18字中大多数都是早期义项陆续取得了两个或三个音读,只有""请、泥、委""3字例外。掌握这一规律,使我们易于理解各字义同与义别交织的复杂关系。(3)这个字群音义关系的产生始于中古前期,唐代加以继承和发展,并广泛应用于诗体律式的平仄变化中。(4)这个字群的音义关系过分复杂,不利于人们的口语交际,因此音义关系到现代有了明显的简化。但是阅读唐诗,分析诗体格律,仍要依据各字中古的音义关系来解释,切不可以今律古。",长江学术,2017-04-15,期刊,I207.22,113-125,13
39,《长江学术》稿约,,《长江学术》编辑部,O,"<正>一、本刊是中国语言文学类学术季刊,欢迎具有学术性、前沿性、思想性的稿件,对视角新颖、选题独特、有创见、有卓识的文稿尤为重视。主要栏目有:海外中国语言文学研究、中国现当代文学研究、中国古代文学研究、文艺学研究、世界文学与比较文学研究、文学与文化研究、汉语言文字学研究、语言学及应用语言学研究、文献学研究、当前语言生活热点问题、汉语国际传播理论与实践、跨文化对话、语言文学演讲录等。二、文章字数一般应控制在一万二千字以内。译稿则须附原文及原作者的授权证明。三、注释:本刊不另列参考文献,相关参考与引用文献皆在注释中说明。一律采用脚注,每页编号自为起止。1.注释项目排列顺序如下:(1)中文注释:期刊:作者,文题,刊名及年卷(期)。例:林庚:《五七言和它的三字尾》,《文学评论》1959年第2期。",长江学术,2017-04-15,期刊,+,129,1
40,否定表达的修辞功能,吴礼权,复旦大学中国语言文学研究所,否定表达;修辞行为;辞格;修辞功能;,"否定表达决不仅仅是语法问题。在实际语言生活中,否定表达往往是一种修辞行为,内蕴深刻的意涵。因此,凡属修辞行为的否定表达,一般都具有特定的修辞功能。有的是为了化抽象为具象,有的是为了化平淡为生动,有的是为了突显强化某种语意印象,有的是为了柔化语气显得礼貌,有的是为了突显被动而赢得同情。当然,还有其他修辞功能。",长江学术,2017-04-15,期刊,H15,103-112,10
41,“莫落”释义考辨,曹海东,华中师范大学文学院,《汉语大词典》;《新序》;莫落;幕络;释义;,"本文通过稽考文献资料,认为《汉语大词典》引刘向《新序》之文为例,训""莫落""为""缀结"",未得确诂;""莫落""实为""幕络""之通借,意为覆盖、蒙罩。",长江学术,2017-04-15,期刊,H164,126-128,3
42,作为“文白分编”的开明新编中学白话文语文课本,商金林,北京大学中文系,叶圣陶;朱自清;吕叔湘;《开明新编国文读本(甲种)》;《开明新编国文读本(乙种)》;《开明新编高级国文读本》;《开明文言读本》;,"抗战胜利后,叶圣陶和郭绍虞、徐调孚、周予同、覃必陶以及朱自清、吕叔湘等一批语文教育家通力合作,采用""文白分编""的方式,突击选编《开明新编国文读本(甲种)》、《开明新编国文读本(乙种)》、《开明新编高级国文读本》和《开明文言读本》等四部全新的初高中语文教材,这四部全新的初高中语文教材被誉为二十世纪最富生命力的语文经典读本。",长江学术,2017-04-15,期刊,G633.3,10-31,22
43,论鲁迅与列·托尔斯泰的人道主义思想,黄健,浙江大学中文系,鲁迅;列·托尔斯泰;人道主义;思想特质;,"人道主义是鲁迅与列·托尔斯泰的思想特质。基于对本民族和人类的爱,两位大文豪都把思想意识聚焦在人的存在、发展和前途命运上,体现了一种人道主义的大爱理念和精神。列·托尔斯泰将人道主义与他的宗教信仰紧密结合在一起,将人道主义融入宗教信念之中,以彻底否定暴力的方式,建构起""托尔斯泰主义"",并展示出宗教与人道主义思想共同宣扬的""博爱""和""宽容""精神。鲁迅则始终把思想聚焦在""人""的层面上,把重点放在对人的根性的审视之上,思考在社会转型时期,如何提升人的素质,建立新型的人格等有关人的生存和发展的问题,并由此提出""立人""的思想,致力于追求人的解放,特别是人的个性解放和精神解放的目标。无疑,两位大文豪的思想在人道主义理念和精神上有着内在的一致性。",长江学术,2017-01-15,期刊,I106,56-63,8
44,《布登勃洛克一家》:托马斯·曼对德国社会的“病理分析”,涂险峰;黄艳,武汉大学文学院,托马斯·曼;疾病;隐喻;社会病;,"托马斯·曼被认为是最德国化的一个作家,他诸多作品都在思考一个核心话题:德国性。在早期作品《布登勃洛克一家》中,托马斯·曼结合西方浪漫主义中疾病隐喻化的传统,对19世纪德国市民社会做出""病理学""意义分析,通过布登勃洛克家族四代人不同人生际遇,梳理出疾病的隐喻,艺术与疾病的正向关系,以及与商业社会的反向关系。最后通过这个家族异化的""病理""循环,表现疾病背后美学指向带来的疯狂与虚无,呈现出托马斯·曼对德国""社会病""的独特思考。",长江学术,2017-01-15,期刊,I516.074,75-83,9
45,2016年“人大复印报刊资料”全文转载情况统计,,O,O,O,长江学术,2017-01-15,期刊,+,2,1
47,谈谈武汉文化的软实力,樊星,武汉大学文学院,码头文化;水文化;商业文化;革命文化;文化与文学;,"武汉再度崛起,因此有必要研究武汉,提升武汉的文化软实力。武汉素以""码头文化""为人所知,但码头文化与革命历史的关系却少有研究。武汉的水文化、商业文化、文学传统与教育优势虽然经常为武汉的学者所论及,仍有待进一步的研究、宣传。本文试图通过对武汉文化综合实力的多角度回顾与研究,为武汉文化研讨拓展思路。同时,指出武汉文化的短板,思考进一步提升武汉城市文化的影响力的问题。",长江学术,2017-01-15,期刊,I207.42,21-27,7
49,“看”的文学革命·“听”的文学革命——1920年代中国的听觉媒介与“国语”实验,平田昌司;贺昌盛,京都大学人文科学研究所厦门大学中文系,“看”的文学革命;国语运动;“听”的国语;“听”的文学;,"现代中国文学的确立离不开""现代汉语""语言的确立,而语言的确立又不单涉及为""看""而生成的""书面语""形态的问题。学界对于晚清民初中国的""文学革新""的研究中,""听""的文学革命一直是一个几乎被完全忽略的非常关键的问题。如果说在推进中国现代性的过程中,文学发挥了难以估量的核心功能的话,那么,以""听觉""作为媒介的文学传播就应当成为构成这一历史进程所不可或缺的基本要素;而且,在不断更新的技术手段的支持下,人们对文学所传达的""现代""意识的接受,事实上更多的不只是""看"",而主要是借助于""听""。据此而言,仅以""看""的文字文献为基础书写出来的文学史不能算是完整的文学史;忽略了""听觉""媒介在现代性演进过程中的巨大功能,也无法真正透视和理解中国现代性的实际境况及其本质特性。",长江学术,2017-01-15,期刊,H109.4,5-20,16
50,传承与裂变——黄侃古音学之建构及其正反评价,王松木,高雄师范大学国文系,黄侃;古音学;章黄学派;学术思想史;,"黄侃(1886—1935)承继清代朴学的研究成果,为审音派古音学之集大成者。然而,当代音韵学者对于黄侃古音学说却有正反两极的评价,其中缘由颇值得玩味。本文采""学术思想史""路径,观察黄侃古音学之建构及其与当代学术思潮之间的互动,冀望藉此阐述黄侃的古音学思想,诠释不同接受者依据何种学术思想来评断黄侃古音学,并且重新估量黄侃古音学在当代学术转型过程中可能蕴含的意义与价值。",长江学术,2017-01-15,期刊,H111,91-114,24
52,论坡义地名词“坂”,邵则遂;唐磊,华中师范大学语言与语言教育研究中心,地名;坂;阪;长坂;大阪;,"本文以地名""长坂坡""为出发点,利用历史文献对""当阳之长坂""中的地名""长坂""演变为""长坂坡""的过程和缘由进行了探究。在探究过程中,首先对坡义地名词""坂""与""阪""进行考释,进而从不同语言角度对坡义地名词""坂""进行了逐一分析。坡义地名词""坂""在汉语方言、域外语言中均有分布,并与少数民族语言中的相关词语互为联系。",长江学术,2017-01-15,期刊,H13,121-128,8
54,孔子没有平民文化教育思想,吴天明,武汉大学文学院,孔子;平民;教育思想;教育实践;,"孔子一生主要是教育上等人,其平民教育思想和实践比较复杂。孔子认为平民道德教育应主要通过教育上等人,提高上等人的道德水平,进而影响平民,提高平民的道德水平。这一思想至今仍有其合理处。而在文化知识教育上,他认为平民""下愚"",而且""困而不学"",根本不堪教育,因此完全无法提高他们的文化知识水平。孔子的教育实践也是如此,他的授业弟子中没有一位是平民,社会弟子也基本上都是上等人。过去学术界一直认为孔子有全民教育思想,这一论断恐怕要重新审视。我们认为,孔子至少没有平民文化教育思想。",长江学术,2017-01-15,期刊,B222.2,84-90,7
1,江户时代异学者皆川淇园的文章学,张淘,四川大学文学与新闻学院,日本江户时期;皆川淇园;《欧苏文弹》;《问学举要》;《淇园文诀》;文章学;,"日本江户时期的皆川淇园对文章学有深入研究,认为古文应追溯直承自上古三代之文,其因在于东汉以后语义发生变化,后人学习古文时必须精通上古三代的作品。韩柳复古,既追求""辞""亦追求""气"",故其文自然气格高,其步骤古人之处颇多,从欧阳修开始,鄙弃辞趣,稍乏古气,其文与古不同。他在《问学举要》《淇园文诀》中提出的文章学理论自成系统,尤其是他的晰文理十五事。《欧苏文弹》对欧阳修、苏轼、苏洵的六篇文章进行了批判和修改,最能直观反映其文章学成就。本论文对这些理论和批评进行翻译和介绍,并指出这些文章学理论和批评具有特异性,与伊藤东涯等古学派的文章理论有着某种内在联系。",长江学术,2018-10-15,期刊,I313.06,87-95,9
2,近百年文学理论发展大势——论姚文放《从形式主义到历史主义》,高玉,浙江师范大学人文学院,姚文放;《从形式主义到历史主义》;文学理论;发展大势;,"《从形式主义到历史主义》一书对20世纪文学理论的发展大势做出了较为深刻的总结,并对这种发展的哲学、社会以及文学的深层机理进行了探究。该书对""内""""外""不同视角下的""文学性""研究理路进行了辨析和总结,揭示了视角变化所导致的对这一问题研究的变化,预示这种研究新的可能性,同时也表达了对于文学理论所造成的深层危机。作者针对文化、政治与文学理论的关系,如何定义经典,以及语言转向与文学理论的研究范式等问题均作了详细的介绍和分析,回应了当下的学术热点问题,为我们提供了不少新的材料、新的理论和新的观点。",长江学术,2018-10-15,期刊,I109-5,54-58,5
3,马克·吐温的“独立宣言”——论《赫克尔贝里·芬历险记》之独立精神,李志斌,武汉工程大学外语学院,马克·吐温;《赫克尔贝里·芬历险记》;独立精神;小说艺术;,"小说《赫克尔贝里·芬历险记》无异于一本文学版的""独立宣言"",其中涉及的平等、安全、自由、独立等重大的人类话题,是马克·吐温政治哲学和艺术哲学的核心内容。本文从创作题材与艺术个性、人物形象塑造和风景描写等不同的角度,探寻了《赫克尔贝里·芬历险记》所展示的独立精神,重新阐释了马克·吐温在美国乃至世界文学领域备受推崇的主要原因。",长江学术,2018-10-15,期刊,I712.074,103-108,6
4,著名评论家於可训教授推出十卷本文集,,O,O,"<正>著名文学评论家、武汉大学人文社会科学资深教授、博士生导师於可训最近推出十卷本《於可训文集》。文集收入於可训几十年学术研究的代表性成果,含文学评论卷(四卷)以及文学理论、作家评传、新诗研究等,由长江文艺出版社出版。文集凝聚了於可训半生文学心血与学术精髓,是新时期中国文学批评的历史见证。有对文学创作、文学史现象的深度研究,如对新世纪以来长篇小说的研究、对当代文学的历",长江学术,2018-10-15,期刊,I206.7,129,1
1,江户时代异学者皆川淇园的文章学,张淘,四川大学文学与新闻学院,日本江户时期;皆川淇园;《欧苏文弹》;《问学举要》;《淇园文诀》;文章学;,"日本江户时期的皆川淇园对文章学有深入研究,认为古文应追溯直承自上古三代之文,其因在于东汉以后语义发生变化,后人学习古文时必须精通上古三代的作品。韩柳复古,既追求""辞""亦追求""气"",故其文自然气格高,其步骤古人之处颇多,从欧阳修开始,鄙弃辞趣,稍乏古气,其文与古不同。他在《问学举要》《淇园文诀》中提出的文章学理论自成系统,尤其是他的晰文理十五事。《欧苏文弹》对欧阳修、苏轼、苏洵的六篇文章进行了批判和修改,最能直观反映其文章学成就。本论文对这些理论和批评进行翻译和介绍,并指出这些文章学理论和批评具有特异性,与伊藤东涯等古学派的文章理论有着某种内在联系。",长江学术,2018-10-15,期刊,I313.06,87-95,9
2,近百年文学理论发展大势——论姚文放《从形式主义到历史主义》,高玉,浙江师范大学人文学院,姚文放;《从形式主义到历史主义》;文学理论;发展大势;,"《从形式主义到历史主义》一书对20世纪文学理论的发展大势做出了较为深刻的总结,并对这种发展的哲学、社会以及文学的深层机理进行了探究。该书对""内""""外""不同视角下的""文学性""研究理路进行了辨析和总结,揭示了视角变化所导致的对这一问题研究的变化,预示这种研究新的可能性,同时也表达了对于文学理论所造成的深层危机。作者针对文化、政治与文学理论的关系,如何定义经典,以及语言转向与文学理论的研究范式等问题均作了详细的介绍和分析,回应了当下的学术热点问题,为我们提供了不少新的材料、新的理论和新的观点。",长江学术,2018-10-15,期刊,I109-5,54-58,5
3,马克·吐温的“独立宣言”——论《赫克尔贝里·芬历险记》之独立精神,李志斌,武汉工程大学外语学院,马克·吐温;《赫克尔贝里·芬历险记》;独立精神;小说艺术;,"小说《赫克尔贝里·芬历险记》无异于一本文学版的""独立宣言"",其中涉及的平等、安全、自由、独立等重大的人类话题,是马克·吐温政治哲学和艺术哲学的核心内容。本文从创作题材与艺术个性、人物形象塑造和风景描写等不同的角度,探寻了《赫克尔贝里·芬历险记》所展示的独立精神,重新阐释了马克·吐温在美国乃至世界文学领域备受推崇的主要原因。",长江学术,2018-10-15,期刊,I712.074,103-108,6
4,著名评论家於可训教授推出十卷本文集,,O,O,"<正>著名文学评论家、武汉大学人文社会科学资深教授、博士生导师於可训最近推出十卷本《於可训文集》。文集收入於可训几十年学术研究的代表性成果,含文学评论卷(四卷)以及文学理论、作家评传、新诗研究等,由长江文艺出版社出版。文集凝聚了於可训半生文学心血与学术精髓,是新时期中国文学批评的历史见证。有对文学创作、文学史现象的深度研究,如对新世纪以来长篇小说的研究、对当代文学的历",长江学术,2018-10-15,期刊,I206.7,129,1
5,论清代论词书札及其词学史意义,祝东,兰州大学国际文化交流学院,清代词学;论词书札;学术交流;词学史;,"书札论词是古代出现的以书信论文学的一种重要形式,与其他词学批评形式相比,它不受韵律、篇幅的限制,写法灵活,涉及内容较为广泛,便于直接研讨各种词学问题。且因书札多为朋旧之间往来的书信,论者一般多能直抒己见,故更能从中窥见论者的真实词学思想。清人用书札的形式阐述词学观点,指评词坛流弊,交流切磋词学疑难问题,论词书札在促进学术交流、推动词学发展方面发挥了类似现代学术期刊的功用。",长江学术,2018-10-15,期刊,I207.23,96-102,7
6,母亲和女儿:以孤儿作为方法,罗鹏;雅莉;蔡杨淇,杜克大学暨南大学文学院,母女;孤儿;茹志鹃;王安忆;元文本;,"茹志鹃和王安忆的母女关系和孤儿身份与她们的文本创作有非常紧密的联系。茹志鹃的孤儿身份在其创作中有不少的反映,无论是《逝去的夜》还是自传体小说《她从那条路上来》,孤儿也宝的形象一直带有茹志鹃强烈的自传性质,投射着作家本身的孤儿情结。作为女儿的王安忆在她创作的《乌托邦诗篇》《小鲍庄》《叔叔的故事》等小说中,通过元文本的创作手法,在文本中表达对母亲孤儿身份与自身孤儿立场的想法,包括在与母亲参加爱荷华国际写作计划的日记中,隐性地表现出女儿对母亲的反抗。在茹志鹃逝世后,王安忆也成为孤儿,她对母亲文学遗产的整理和思考,使得她对母亲以及母女关系的理解有了很大的变化。",长江学术,2018-10-15,期刊,I207.42,25-32,8
